prix,titre,lieu,surface,ville_scrape
5 000 000 DH,A vendre Villa à laymoune,A vendre Villa à laymoune,380 m²,casablanca
4 350 000 DH,Vend appartement à Anfa. 4 grandes pièces. Prestation de con...,Vend appartement à Anfa. 4 grandes pièces. Prestation de con...,173 m²,casablanca
745 500 DH,Appartement à l'achat à Bournazil. Superficie 71 m²,Appartement à l'achat à Bournazil. Superficie 71 m²,Appartement à l'achat à Bournazil. Superficie 71 m²,casablanca
Projet · 20 biens immobiliers,Evergreen,Evergreen,96 m²,casablanca
5 400 000 DH,Magnifique villa à vendre à Ain Diab Extension,Magnifique villa à vendre à Ain Diab Extension,278 m²,casablanca
42 850 000 DH,À vendre – villa d’exception à ain diab – cadre privilégié &...,À vendre – villa d’exception à ain diab – cadre privilégié &...,2090 m²,casablanca
2 200 000 DH,Appartement à vendre Les princesses,Appartement à vendre Les princesses,184 m²,casablanca
Prix à consulter,Studio Meublé Neuf avec Parking,Studio Meublé Neuf avec Parking,42 m²,casablanca
À partir de 375 000 DH,Ocean 3 - Appartements à vendre,IMMOBILIER NEUF,,casablanca
1 600 000 DH,Appartement à vendre quartier Floride sidi Maarouf,Appartement à vendre quartier Floride sidi Maarouf,124 m²,casablanca
976 000 DH,Vente d'un Studio à Californie,Vente d'un Studio à Californie,47 m²,casablanca
1 209 100 DH,Superbe appartement à vendre à Nozha Aïn Sebaâ. Surface de 8...,Superbe appartement à vendre à Nozha Aïn Sebaâ. Surface de 8...,102 m²,casablanca
760 000 DH,Un beau appartement de 98m² neuf à vendre,Un beau appartement de 98m² neuf à vendre,Un beau appartement de 98m² neuf à vendre,casablanca
2 800 000 DH,Appartement à vendre à Ain Diab Extension. 3 chambres,Appartement à vendre à Ain Diab Extension. 3 chambres,204 m²,casablanca
780 000 DH,Appartement à vendre à Aïn Sebaâ. Surface de 72 m²,Appartement à vendre à Aïn Sebaâ. Surface de 72 m²,Appartement à vendre à Aïn Sebaâ. Surface de 72 m²,casablanca
2 000 000 DH,Les Princesses. Résidence sécurisée. Appartement. 2Ch,Les Princesses. Résidence sécurisée. Appartement. 2Ch,80 m²,casablanca
3 000 000 DH,Appartement spacieux 267m2 à Gauthier,Appartement spacieux 267m2 à Gauthier,267 m²,casablanca
6 810 000 DH,Villa usage habitation ou commerciale sidi maarouf,Villa usage habitation ou commerciale sidi maarouf,600 m²,casablanca
2 100 000 DH,Votre prochain coup de cœur au quartier Les Princesses,Votre prochain coup de cœur au quartier Les Princesses,127 m²,casablanca
13 000 000 DH,Vente Superbe Villa Val d’Anfa,Vente Superbe Villa Val d’Anfa,400 m²,casablanca
4 150 000 DH,À VENDRE – Grand Appartement d’Exception,À VENDRE – Grand Appartement d’Exception,293 m²,casablanca
8 800 000 DH,Ain Diab. Villa de charme. Avec jardin et terrasse. 5 pièces...,Ain Diab. Villa de charme. Avec jardin et terrasse. 5 pièces...,350 m²,casablanca
20 000 000 DH,Anfa. Villa de prestige à fort potentiel. 600m2,Anfa. Villa de prestige à fort potentiel. 600m2,600 m²,casablanca
2 550 000 DH,A vendre un joli appartement bien ensoleillé,A vendre un joli appartement bien ensoleillé,186 m²,casablanca
3 800 000 DH,A vendre un joli appartement 4 ch et terrasse,A vendre un joli appartement 4 ch et terrasse,190 m²,casablanca
6 800 000 DH,Magnifique villa à vendre à Polo en résidence. 6 grandes pi...,Magnifique villa à vendre à Polo en résidence. 6 grandes pi...,420 m²,casablanca
1 600 000 DH,Appartement haut standing au cœur du centre ville,Appartement haut standing au cœur du centre ville,111 m²,casablanca
1 250 000 DH,Superbe Appartement 125 m2 Bourgone Opportunité Rare,Superbe Appartement 125 m2 Bourgone Opportunité Rare,125 m²,casablanca
2 600 000 DH,Appartement 186 mètres 3 chambres Racine,Appartement 186 mètres 3 chambres Racine,186 m²,casablanca
14 500 DH,Sans Agence: Appart Meublé 120m² Bourgogne,Sans Agence: Appart Meublé 120m² Bourgogne,Sans Agence: Appart Meublé 120m² Bourgogne,casablanca
1 950 000 DH,Joli Duplex au dernier étage / belle residence,Joli Duplex au dernier étage / belle residence,134 m²,casablanca
4 000 000 DH,Duplex 4 chambres avec jardin privé,Duplex 4 chambres avec jardin privé,248 m²,casablanca
1 650 000 DH,"Gauthier, 3 ch. Grande Terrasse ensoleillée","Gauthier, 3 ch. Grande Terrasse ensoleillée",118 m²,casablanca
5 000 000 DH,Superbe appartement à vendre à Anfa. 3 pièces confortables...,Superbe appartement à vendre à Anfa. 3 pièces confortables...,189 m²,casablanca
880 000 DH,Appartement à l'achat à Bournazil. Surface totale 80 m²,Appartement à l'achat à Bournazil. Surface totale 80 m²,Appartement à l'achat à Bournazil. Surface totale 80 m²,casablanca
5 500 000 DH,Somptueuse maison à vendre à Ain Diab Extension,Somptueuse maison à vendre à Ain Diab Extension,230 m²,casablanca
Projet · 20 biens immobiliers,Evergreen,Evergreen,96 m²,casablanca
1 550 000 DH,Appartement a vendre neuf maarif ext,Appartement a vendre neuf maarif ext,79 m²,casablanca
2 200 000 DH,Palmier. Appartement. 140m2. Avec terrasse et ascenseur,Palmier. Appartement. 140m2. Avec terrasse et ascenseur,140 m²,casablanca
3 100 000 DH,A vendre un bel appartement,A vendre un bel appartement,199 m²,casablanca
1 400 000 DH,Appt 85m2 entièrement rénové orientation Sud,Appt 85m2 entièrement rénové orientation Sud,85 m²,casablanca
À partir de 528 000 DH,Lotissement Miftah El Kheir Settat R+3 à R+5,IMMOBILIER NEUF,,casablanca
1 150 000 DH,Studios haut standing neuf entre 40 et 60 m2,Studios haut standing neuf entre 40 et 60 m2,40 m²,casablanca
1 400 000 DH,Appartement à vendre à Californie. 2 belles chambres,Appartement à vendre à Californie. 2 belles chambres,86 m²,casablanca
1 211 260 DH,Nouvelle Résidence Nozha Ain Sebaâ _ Appartement 2 chambres,Nouvelle Résidence Nozha Ain Sebaâ _ Appartement 2 chambres,93 m²,casablanca
650 000 DH,Appartement à vendre. Surface de 85 m²,Appartement à vendre. Surface de 85 m²,Appartement à vendre. Surface de 85 m²,casablanca
3 100 000 DH,Appartement à vendre à Ain Diab Extension. 3 belles chambres,Appartement à vendre à Ain Diab Extension. 3 belles chambres,217 m²,casablanca
840 000 DH,Vente d'un bel appartement à Aïn Sebaâ. 2 belles chambres te...,Vente d'un bel appartement à Aïn Sebaâ. 2 belles chambres te...,79 m²,casablanca
3 400 000 DH,Habit immobilier met en vente un appartement villa de 4 cham...,Habit immobilier met en vente un appartement villa de 4 cham...,274 m²,casablanca
2 580 000 DH,Habit immobilier met en vente un joli appartement,Habit immobilier met en vente un joli appartement,132 m²,casablanca
2 500 000 DH,Habit immobilier met en vente un joli appartement,Habit immobilier met en vente un joli appartement,132 m²,casablanca
1 650 000 DH,A vendre un joli appartement vide avec terrasse,A vendre un joli appartement vide avec terrasse,117 m²,casablanca
3 000 000 DH,A vendre un joli appartement,A vendre un joli appartement,202 m²,casablanca
1 180 000 DH,Vente d'un bel appartement à Bourgogne Ouest. 2 pièces confo...,Vente d'un bel appartement à Bourgogne Ouest. 2 pièces confo...,52 m²,casablanca
1 200 000 DH,Superbe appartement à vendre à Les princesses. 1 belle chamb...,Superbe appartement à vendre à Les princesses. 1 belle chamb...,50 m²,casablanca
1 350 000 DH,Bel appartement à vendre à Bourgogne Ouest. 1 belle chambre...,Bel appartement à vendre à Bourgogne Ouest. 1 belle chambre...,56 m²,casablanca
2 850 000 DH,Appartement en vente à Maârif Extension. Surface de 177 m²...,Appartement en vente à Maârif Extension. Surface de 177 m²...,Appartement en vente à Maârif Extension. Surface de 177 m²...,casablanca
15 000 000 DH,Maison de luxe à vendre à Californie à 200 mètres de l’école...,Maison de luxe à vendre à Californie à 200 mètres de l’école...,850 m²,casablanca
1 050 000 DH,Appartement neuf à vendre Les Jardins de Bali à Quartier Bac...,Appartement neuf à vendre Les Jardins de Bali à Quartier Bac...,60 m²,casablanca
1 100 000 DH,Appartements Neufs haut standing à Ain Sebaa,Appartements Neufs haut standing à Ain Sebaa,250 m²,casablanca
630 000 DH,Appartement à vendre,Appartement à vendre,59 m²,casablanca
870 000 DH,Appartement 127m2 salmiya 2 facade,Appartement 127m2 salmiya 2 facade,127 m²,casablanca
1 150 000 DH,Vente studio neuf et lumineux quartier Riviera,Vente studio neuf et lumineux quartier Riviera,49 m²,casablanca
2 740 000 DH,Vend appartement à Maârif Extension. Surface totale 117 m²,Vend appartement à Maârif Extension. Surface totale 117 m²,Vend appartement à Maârif Extension. Surface totale 117 m²,casablanca
15 000 000 DH,Villa Commerciale de 627 m2 à Bd Dris Slaoui,Villa Commerciale de 627 m2 à Bd Dris Slaoui,627 m²,casablanca
3 100 000 DH,Superbe appartement à vendre à Ain Diab Extension. Surface t...,Superbe appartement à vendre à Ain Diab Extension. Surface t...,217 m²,casablanca
4 600 000 DH,Vend appartement à Anfa. 2 belles chambres. Prestation de co...,Vend appartement à Anfa. 2 belles chambres. Prestation de co...,169 m²,casablanca
1 827 000 DH,Appartement en vente à Bournazil. Surface de 174 m²,Appartement en vente à Bournazil. Surface de 174 m²,Appartement en vente à Bournazil. Surface de 174 m²,casablanca
5 500 000 DH,Superbe villa à vendre à Ain diab Extension,Superbe villa à vendre à Ain diab Extension,257 m²,casablanca
Projet · 20 biens immobiliers,Evergreen,Evergreen,96 m²,casablanca
7 000 000 DH,A vendre villa a californie,A vendre villa a californie,440 m²,casablanca
1 070 000 DH,Vend appartement à Oasis. 1 chambre. Chauffage central et...,Vend appartement à Oasis. 1 chambre. Chauffage central et...,55 m²,casablanca
1 200 000 DH,Studio Haut Standing a vendre les princesses,Studio Haut Standing a vendre les princesses,55 m²,casablanca
970 000 DH,"Vente Appart 86 m2 à Hay INARA 1, proximité 2 Mars","Vente Appart 86 m2 à Hay INARA 1, proximité 2 Mars",86 m²,casablanca
À partir de 2 100 000 DH,Wahat El Moutawassit - Lots de terrain R+5,IMMOBILIER NEUF,,casablanca
770 000 DH,Appartement de charme à Roche Noire,Appartement de charme à Roche Noire,75 m²,casablanca
1 400 000 DH,Bel appartement à vendre à Californie. Superficie 101 m²,Bel appartement à vendre à Californie. Superficie 101 m²,Bel appartement à vendre à Californie. Superficie 101 m²,casablanca
998 705 DH,Appartement à vendre à Nozha Aïn Sebaâ. Surface totale 70 m²,Appartement à vendre à Nozha Aïn Sebaâ. Surface totale 70 m²,Appartement à vendre à Nozha Aïn Sebaâ. Surface totale 70 m²,casablanca
660 000 DH,Appartement à vendre à Sidi Moumen. 87m²,Appartement à vendre à Sidi Moumen. 87m²,Appartement à vendre à Sidi Moumen. 87m²,casablanca
3 550 000 DH,Superbe appartement à vendre à Ain Diab Extension. Surface t...,Superbe appartement à vendre à Ain Diab Extension. Surface t...,270 m²,casablanca
850 000 DH,Appartement à VENDRE à Aïn Sebaâ. Surface totale 75m²14m² de...,Appartement à VENDRE à Aïn Sebaâ. Surface totale 75m²14m² de...,Appartement à VENDRE à Aïn Sebaâ. Surface totale 75m²14m² de...,casablanca
970 000 DH,Appartement en vente à Casablanca Finance City. 1 Pièce. Ant...,Appartement en vente à Casablanca Finance City. 1 Pièce. Ant...,42 m²,casablanca
15 000 000 DH,Vente villa de luxe à Californie. Surface de 1050 m². Syst...,Vente villa de luxe à Californie. Surface de 1050 m². Syst...,Vente villa de luxe à Californie. Surface de 1050 m². Syst...,casablanca
1 475 000 DH,Magnifique appartement haut standing de 97 m² à vendre – Val...,Magnifique appartement haut standing de 97 m² à vendre – Val...,Magnifique appartement haut standing de 97 m² à vendre – Val...,casablanca
2 000 000 DH,Burger 206 m² 3ch 2sdb terrasse prix sacrifié,Burger 206 m² 3ch 2sdb terrasse prix sacrifié,Burger 206 m² 3ch 2sdb terrasse prix sacrifié,casablanca
2 500 000 DH,Rare et beau vend parfait 4ch 2 park175m² bon prix,Rare et beau vend parfait 4ch 2 park175m² bon prix,Rare et beau vend parfait 4ch 2 park175m² bon prix,casablanca
36 000 000 DH,Villa au coeur d’Anfa supérieur,Villa au coeur d’Anfa supérieur,1000 m²,casablanca
34 500 000 DH,Belle villa Anfa 2100 mètres,Belle villa Anfa 2100 mètres,2000 m²,casablanca
21 000 000 DH,Belle Villa sur ANFA 1100 mètres,Belle Villa sur ANFA 1100 mètres,1100 m²,casablanca
45 000 000 DH,Anfa Supérieur imposante Villa 1550 mètres,Anfa Supérieur imposante Villa 1550 mètres,1550 m²,casablanca
3 900 000 DH,Appartement à vendre à Racine. Surface de 231 m². Avec asc...,Appartement à vendre à Racine. Surface de 231 m². Avec asc...,Appartement à vendre à Racine. Surface de 231 m². Avec asc...,casablanca
870 000 DH,Studio à vendre Mers Sultan d'une superficie 43m2,Studio à vendre Mers Sultan d'une superficie 43m2,43 m²,casablanca
9 800 000 DH,Villa de 1055 m2 TRES BONNE AFFAIRE,Villa de 1055 m2 TRES BONNE AFFAIRE,1055 m²,casablanca
1 570 000 DH,Vente d'un bel appartement à Maârif Extension. 2 belles cham...,Vente d'un bel appartement à Maârif Extension. 2 belles cham...,84 m²,casablanca
770 000 DH,Bel appartement à vendre à Roches Noires. Surface de 49 m²...,Bel appartement à vendre à Roches Noires. Surface de 49 m²...,Bel appartement à vendre à Roches Noires. Surface de 49 m²...,casablanca
17 000 000 DH,Villa de 961 m2 à ZOM ANFA,Villa de 961 m2 à ZOM ANFA,961 m²,casablanca
2 150 000 DH,Vente Appartement à palmier,Vente Appartement à palmier,125 m²,casablanca
600 000 DH,Vente Appartement à Errahma,Vente Appartement à Errahma,73 m²,casablanca
9 500 000 DH,Villa de 589m² à EL MANAR A SAISIR,Villa de 589m² à EL MANAR A SAISIR,Villa de 589m² à EL MANAR A SAISIR,casablanca
4 100 000 DH,Bel appartement à vendre à Anfa. Surface totale 159 m²,Bel appartement à vendre à Anfa. Surface totale 159 m²,Bel appartement à vendre à Anfa. Surface totale 159 m²,casablanca
1 954 000 DH,Bel appartement à vendre à Bournazil. 3 chambres agréables,Bel appartement à vendre à Bournazil. 3 chambres agréables,174 m²,casablanca
6 000 000 DH,Splendide villa à vendre à Ain diab Extension,Splendide villa à vendre à Ain diab Extension,413 m²,casablanca
Projet · 20 biens immobiliers,Evergreen,Evergreen,96 m²,casablanca
5 000 000 DH,Appartement d'exception en étage élevé,Appartement d'exception en étage élevé,161 m²,casablanca
1 640 000 DH,Appartement premium a saisir,Appartement premium a saisir,75 m²,casablanca
1 150 000 DH,Studio premium à saisir,Studio premium à saisir,51 m²,casablanca
1 125 000 DH,Studio premium à saisir,Studio premium à saisir,45 m²,casablanca
À partir de 884 760 DH,Chemsi Lotissement,IMMOBILIER NEUF,,casablanca
1 250 000 DH,Studio premium à saisir,Studio premium à saisir,50 m²,casablanca
1 398 500 DH,Appartement en vente à Californie. 3 chambres,Appartement en vente à Californie. 3 chambres,82 m²,casablanca
990 641 DH,Appartement moderne à Nozha Aïn Sebaâ. Superficie 88 m²,Appartement moderne à Nozha Aïn Sebaâ. Superficie 88 m²,Appartement moderne à Nozha Aïn Sebaâ. Superficie 88 m²,casablanca
735 000 DH,Appartement à vendre à Sidi Moumen. Superficie 100 m²,Appartement à vendre à Sidi Moumen. Superficie 100 m²,Appartement à vendre à Sidi Moumen. Superficie 100 m²,casablanca
2 800 000 DH,Vente d'un bel appartement à Ain Diab Extension. Surface tot...,Vente d'un bel appartement à Ain Diab Extension. Surface tot...,204 m²,casablanca
980 000 DH,Appartement à vendre à Aïn Sebaâ. 3 chambres agréables,Appartement à vendre à Aïn Sebaâ. 3 chambres agréables,98 m²,casablanca
1 350 000 DH,Studio premium à sasir,Studio premium à sasir,56 m²,casablanca
1 320 000 DH,Studio premium avec terrasse,Studio premium avec terrasse,94 m²,casablanca
1 130 000 DH,Studio premium à saisir,Studio premium à saisir,50 m²,casablanca
1 430 000 DH,Studio premium à saisir,Studio premium à saisir,58 m²,casablanca
900 000 DH,Studio premium à saisir,Studio premium à saisir,42 m²,casablanca
1 770 000 DH,Appartement premium a saisir,Appartement premium a saisir,76 m²,casablanca
1 200 000 DH,Studio premium avec terrasse,Studio premium avec terrasse,70 m²,casablanca
1 220 000 DH,Studio premium à saisir sans vis a vis,Studio premium à saisir sans vis a vis,65 m²,casablanca
1 120 000 DH,Studio premium a saisir,Studio premium a saisir,50 m²,casablanca
1 380 000 DH,Duplex premium à saisir,Duplex premium à saisir,88 m²,casablanca
22 000 000 DH,Villa Commerciale de 1800 m2 à Bd Panoramique,Villa Commerciale de 1800 m2 à Bd Panoramique,1800 m²,casablanca
830 000 DH,Très bel appartement 83 m2,Très bel appartement 83 m2,83 m²,casablanca
1 250 000 DH,Vente d'un bel appartement à Palmier. 1 chambre. Double vi...,Vente d'un bel appartement à Palmier. 1 chambre. Double vi...,80 m²,casablanca
1 200 000 DH,Superbe appartement à vendre à Anfa,Superbe appartement à vendre à Anfa,58 m²,casablanca
980 000 DH,Superbe appartement à vendre à Les princesses. Surface total...,Superbe appartement à vendre à Les princesses. Surface total...,45 m²,casablanca
11 500 000 DH,Villa de 1422 m2 à Californie TRES BONNE AFFAIRE,Villa de 1422 m2 à Californie TRES BONNE AFFAIRE,1422 m²,casablanca
12 000 000 DH,Villa de 619 m2 à ZOM ANFA,Villa de 619 m2 à ZOM ANFA,619 m²,casablanca
3 500 000 DH,Vente d'un bel appartement au quartiers Californie,Vente d'un bel appartement au quartiers Californie,237 m²,casablanca
4 100 000 DH,Appartement en vente à Anfa. Superficie 159 m²,Appartement en vente à Anfa. Superficie 159 m²,Appartement en vente à Anfa. Superficie 159 m²,casablanca
887 000 DH,Vente d'un bel appartement à Bournazil. 3 chambres,Vente d'un bel appartement à Bournazil. 3 chambres,77 m²,casablanca
6 000 000 DH,Maison de luxe à vendre. Surface totale 400 m²,Maison de luxe à vendre. Surface totale 400 m²,Maison de luxe à vendre. Surface totale 400 m²,casablanca
Projet · 20 biens immobiliers,Evergreen,Evergreen,96 m²,casablanca
1 300 000 DH,Studio premium à saisir,Studio premium à saisir,51 m²,casablanca
1 370 000 DH,Studio premium à saisir,Studio premium à saisir,57 m²,casablanca
1 350 000 DH,Studio premium à saisir,Studio premium à saisir,57 m²,casablanca
1 200 000 DH,Studio premium à saisir,Studio premium à saisir,56 m²,casablanca
À partir de 800 000 DH,Heaven Beach,IMMOBILIER NEUF,,casablanca
1 250 000 DH,Duplex premium à saisir,Duplex premium à saisir,65 m²,casablanca
1 700 000 DH,Appartement en vente à Californie. 3 chambres,Appartement en vente à Californie. 3 chambres,127 m²,casablanca
1 006 770 DH,Appartement à l'achat à Nozha Aïn Sebaâ. Surface de 88 m²,Appartement à l'achat à Nozha Aïn Sebaâ. Surface de 88 m²,Appartement à l'achat à Nozha Aïn Sebaâ. Surface de 88 m²,casablanca
820 000 DH,Appartement neuf à vendre. 108m²,Appartement neuf à vendre. 108m²,Appartement neuf à vendre. 108m²,casablanca
3 100 000 DH,Vente d'un bel appartement à Ain Diab Extension. Superficie...,Vente d'un bel appartement à Ain Diab Extension. Superficie...,217 m²,casablanca
1 040 000 DH,Superbe appartement à vendre à Aïn Sebaâ. 3 chambres agréabl...,Superbe appartement à vendre à Aïn Sebaâ. 3 chambres agréabl...,100 m²,casablanca
1 090 000 DH,Studio premium à saisir,Studio premium à saisir,50 m²,casablanca
1 250 000 DH,Studio premium à saisir,Studio premium à saisir,52 m²,casablanca
1 350 000 DH,Studio premium avec terrasse,Studio premium avec terrasse,60 m²,casablanca
1 280 000 DH,Studio premium à saisir,Studio premium à saisir,47 m²,casablanca
1 730 000 DH,Appartement premium à saisir,Appartement premium à saisir,87 m²,casablanca
1 350 000 DH,Studio premium à saisir,Studio premium à saisir,57 m²,casablanca
1 180 000 DH,Studio premium à saisir,Studio premium à saisir,45 m²,casablanca
1 190 000 DH,Studio premium à saisir,Studio premium à saisir,45 m²,casablanca
1 250 000 DH,Studio premium tres bien meublé à saisir,Studio premium tres bien meublé à saisir,50 m²,casablanca
1 320 000 DH,Studio premium à saisir,Studio premium à saisir,49 m²,casablanca
2 500 000 DH,Superbe appartement au CIL proche Parc CFC,Superbe appartement au CIL proche Parc CFC,130 m²,casablanca
1 350 000 DH,Studio à vendre – Ferme Bretonne,Studio à vendre – Ferme Bretonne,48 m²,casablanca
240 000 DH,Joli apart oulfa Charaf 2,Joli apart oulfa Charaf 2,40 m²,casablanca
23 000 000 DH,Villa Commerciale de 2200 m2 à Bd Modibo Keita,Villa Commerciale de 2200 m2 à Bd Modibo Keita,2200 m²,casablanca
770 000 DH,Appartement à vendre à Roches Noires. 1 chambre. Parking et...,Appartement à vendre à Roches Noires. 1 chambre. Parking et...,49 m²,casablanca
1 950 000 DH,Appartement haut standing à jnane Californie,Appartement haut standing à jnane Californie,109 m²,casablanca
Prix à consulter,Appartement à l'achat à Les Hôpitaux. Surface de 34 m². Gara...,Appartement à l'achat à Les Hôpitaux. Surface de 34 m². Gara...,Appartement à l'achat à Les Hôpitaux. Surface de 34 m². Gara...,casablanca
3 550 000 DH,Superbe appartement à vendre à Ain Diab Extension. 4 belles...,Superbe appartement à vendre à Ain Diab Extension. 4 belles...,270 m²,casablanca
4 600 000 DH,Superbe appartement à vendre à Anfa. Surface totale 169 m²,Superbe appartement à vendre à Anfa. Surface totale 169 m²,Superbe appartement à vendre à Anfa. Surface totale 169 m²,casablanca
725 000 DH,Appartement à vendre à Anfa. Surface totale 33 m². Terrasse...,Appartement à vendre à Anfa. Surface totale 33 m². Terrasse...,Appartement à vendre à Anfa. Surface totale 33 m². Terrasse...,casablanca
1 900 000 DH,Appartement en vente à Ain Diab Extension. Surface de 126 m²,Appartement en vente à Ain Diab Extension. Surface de 126 m²,Appartement en vente à Ain Diab Extension. Surface de 126 m²,casablanca
Projet · 20 biens immobiliers,Evergreen,Evergreen,96 m²,casablanca
1 900 000 DH,Studio premium à saisir,Studio premium à saisir,58 m²,casablanca
1 280 000 DH,Studio premium à saisir,Studio premium à saisir,45 m²,casablanca
1 300 000 DH,Studio premium à saisir,Studio premium à saisir,50 m²,casablanca
1 320 000 DH,Studio premium à saisir,Studio premium à saisir,54 m²,casablanca
À partir de 2 069 000 DH,Appartements haut standing - Dernières disponibilités!,IMMOBILIER NEUF,,casablanca
1 280 000 DH,Studio premium avec terrasse,Studio premium avec terrasse,56 m²,casablanca
2 050 250 DH,Bel appartement à vendre à Californie. 3 belles chambres,Bel appartement à vendre à Californie. 3 belles chambres,133 m²,casablanca
990 641 DH,Nozha Aïn Sebaâ. Bel appartement à vendre. 2 chambres,Nozha Aïn Sebaâ. Bel appartement à vendre. 2 chambres,77 m²,casablanca
860 000 DH,Appartement à vendre à Sidi Moumen,Appartement à vendre à Sidi Moumen,98 m²,casablanca
815 000 DH,Superbe appartement à vendre à Aïn Sebaâ. 2 belles chambres...,Superbe appartement à vendre à Aïn Sebaâ. 2 belles chambres...,81 m²,casablanca
770 000 DH,Appartement à l'achat à Roches Noires. 1 chambre. Parking et...,Appartement à l'achat à Roches Noires. 1 chambre. Parking et...,49 m²,casablanca
1 350 000 DH,Studio haut standing a saisir,Studio haut standing a saisir,53 m²,casablanca
1 250 000 DH,Appartement a vendre a beauséjour ghandi,Appartement a vendre a beauséjour ghandi,100 m²,casablanca
25 000 000 DH,Villa de Charme Californie,Villa de Charme Californie,2527 m²,casablanca
9 000 000 DH,Villa Coup de cœur Californie,Villa Coup de cœur Californie,462 m²,casablanca
20 000 000 DH,Villa Style Provençal Californie,Villa Style Provençal Californie,1500 m²,casablanca
3 950 000 DH,Très bel appartement à vendre MAARIF EXTENSION,Très bel appartement à vendre MAARIF EXTENSION,250 m²,casablanca
1 400 000 DH,Studio avec terrasse etage eleve,Studio avec terrasse etage eleve,70 m²,casablanca
1 690 000 DH,Appartement à l'achat à Oasis. Surface de 94 m². Ascenseur e...,Appartement à l'achat à Oasis. Surface de 94 m². Ascenseur e...,Appartement à l'achat à Oasis. Surface de 94 m². Ascenseur e...,casablanca
11 000 000 DH,Magnifique villa à vendre à Sidi Maarouf. 5 grandes pièces...,Magnifique villa à vendre à Sidi Maarouf. 5 grandes pièces...,1150 m²,casablanca
3 200 000 DH,Vend appartement à Racine. 3 belles chambres. Cheminée et cl...,Vend appartement à Racine. 3 belles chambres. Cheminée et cl...,133 m²,casablanca
Prix à consulter,Appartement à vendre à Oasis. 2 chambres. Ascenseur et stati...,Appartement à vendre à Oasis. 2 chambres. Ascenseur et stati...,43 m²,casablanca
22 000 000 DH,Villa Commerciale de 985 m2 à Bd Dris Slaoui,Villa Commerciale de 985 m2 à Bd Dris Slaoui,985 m²,casablanca
13 000 000 DH,Villa de 1020 m2 à Califronie,Villa de 1020 m2 à Califronie,1020 m²,casablanca
16 000 000 DH,Villa Commerciale de 1350 m2 à Bd La Mecque,Villa Commerciale de 1350 m2 à Bd La Mecque,1350 m²,casablanca
670 000 DH,Appartement en vente à Roches Noires. 2 pièces confortables...,Appartement en vente à Roches Noires. 2 pièces confortables...,37 m²,casablanca
8 000 000 DH,Villa de 550 m2 à Résidence sécurisée à Californie,Villa de 550 m2 à Résidence sécurisée à Californie,550 m²,casablanca
60 000 000 DH,Villa 3200m² à ANFA SUPÉRIEURE,Villa 3200m² à ANFA SUPÉRIEURE,Villa 3200m² à ANFA SUPÉRIEURE,casablanca
969 000 DH,Superbe Appartement à Aïn Sebaâ. 3 chambres 2 Salles de bain,Superbe Appartement à Aïn Sebaâ. 3 chambres 2 Salles de bain,102 m²,casablanca
4 500 000 DH,Bel appartement à vendre à Anfa. Superficie 169 m²,Bel appartement à vendre à Anfa. Superficie 169 m²,Bel appartement à vendre à Anfa. Superficie 169 m²,casablanca
