prix,titre,lieu,surface,ville_scrape
5 200 000 DH,Appartement à l'achat à Souissi. 2 chambres,Appartement à l'achat à Souissi. 2 chambres,160 m²,rabat
3 250 000 DH,Appartement a vendre à prestigia hay riad,Appartement a vendre à prestigia hay riad,117 m²,rabat
9 700 000 DH,Votre villa de reve a el menzah la vallee,Votre villa de reve a el menzah la vallee,720 m²,rabat
9 500 000 DH,Villa à vendre Hay Riad Rabat,Villa à vendre Hay Riad Rabat,1080 m²,rabat
16 500 000 DH,Villa plain pied à vendre Bir Qacem Souissi Rabat,Villa plain pied à vendre Bir Qacem Souissi Rabat,2004 m²,rabat
2 900 000 DH,"Appartement idéal à la vente à Agdal, Rabat","Appartement idéal à la vente à Agdal, Rabat",154 m²,rabat
7 000 000 DH,Villa à vendre à l'aviation mabella,Villa à vendre à l'aviation mabella,823 m²,rabat
3 400 000 DH,"Appartement à Vendre de 163.0 m² à Rabat, Riyad","Appartement à Vendre de 163.0 m² à Rabat, Riyad","Appartement à Vendre de 163.0 m² à Rabat, Riyad",rabat
1 250 000 DH,Bel appartement F2 vendre sur agdal,Bel appartement F2 vendre sur agdal,43 m²,rabat
2 200 000 DH,Appartement en vente sur Hay Riad,Appartement en vente sur Hay Riad,94 m²,rabat
3 250 000 DH,Appartement à vendre sur Hay Riad,Appartement à vendre sur Hay Riad,144 m²,rabat
14 000 000 DH,Villa à vendre sur Souissi,Villa à vendre sur Souissi,2000 m²,rabat
2 200 000 DH,Appartement a vendre à agdal,Appartement a vendre à agdal,89 m²,rabat
8 500 000 DH,Maison de luxe à vendre à Souissi. 4 pièces confortables. Pa...,Maison de luxe à vendre à Souissi. 4 pièces confortables. Pa...,1000 m²,rabat
6 200 000 DH,Vue sur Foret Appartement à Vendre Haut Agdal,Vue sur Foret Appartement à Vendre Haut Agdal,260 m²,rabat
1 800 000 DH,"Bel appartement à Vendre – Avenue Hassan II, Rabat","Bel appartement à Vendre – Avenue Hassan II, Rabat",186 m²,rabat
1 520 000 DH,Appartement à vendre à l'agdal,Appartement à vendre à l'agdal,82 m²,rabat
Prix à consulter,EXCLUSIVITE Rabat I Avenue Tadla / Avenue Mohammed VI,EXCLUSIVITE Rabat I Avenue Tadla / Avenue Mohammed VI,97 m²,rabat
30 000 000 DH,Somptueuse villa à vendre à Souissi. Surface totale 2000 m²...,Somptueuse villa à vendre à Souissi. Surface totale 2000 m²...,Somptueuse villa à vendre à Souissi. Surface totale 2000 m²...,rabat
5 100 000 DH,Appartement de lux à jnan souissi sans vis à vis,Appartement de lux à jnan souissi sans vis à vis,160 m²,rabat
1 640 000 DH,Appartement front mer rabat,Appartement front mer rabat,84 m²,rabat
9 500 000 DH,Villa à vendre Hay Riad Rabat,Villa à vendre Hay Riad Rabat,1080 m²,rabat
1 650 000 DH,Bel appartement à vendre à Hay Al Massira,Bel appartement à vendre à Hay Al Massira,134 m²,rabat
3 600 000 DH,Un magnifique appartement à vendre,Un magnifique appartement à vendre,136 m²,rabat
11 000 000 DH,Villa à vendre sur Hay Riad,Villa à vendre sur Hay Riad,1000 m²,rabat
À partir de 4 462 000 DH,Les Jardins de Val d'or - Villas finies,IMMOBILIER NEUF,,rabat
12 000 000 DH,Villa à vendre sur Souissi,Villa à vendre sur Souissi,2200 m²,rabat
2 000 000 DH,Appartement a vendre à agdal,Appartement a vendre à agdal,83 m²,rabat
1 300 000 DH,Appartement a vendre,Appartement a vendre,105 m²,rabat
8 500 000 DH,Villa à vendre à Hay Riad,Villa à vendre à Hay Riad,380 m²,rabat
1 020 000 DH,Opportunité très rare appartement à vendre à Temara 7 pièce...,Opportunité très rare appartement à vendre à Temara 7 pièce...,116 m²,rabat
3 400 000 DH,Duplex avec piscine Ã l'aviation,Duplex avec piscine Ã l'aviation,274 m²,rabat
Prix à consulter,Splendide villa à vendre à Riyad. Surface totale 350 m². P...,Splendide villa à vendre à Riyad. Surface totale 350 m². P...,Splendide villa à vendre à Riyad. Surface totale 350 m². P...,rabat
2 650 000 DH,Affaire à saisir pour cet appartement à vendre,Affaire à saisir pour cet appartement à vendre,186 m²,rabat
4 200 000 DH,Appartement a vendre prestigia Hay Ryad,Appartement a vendre prestigia Hay Ryad,145 m²,rabat
3 400 000 DH,A vendre INCROYABLE 140m² 3 chambres Hay Riad,A vendre INCROYABLE 140m² 3 chambres Hay Riad,A vendre INCROYABLE 140m² 3 chambres Hay Riad,rabat
7 600 000 DH,Appartement de haut standing en vente à hay Riyad. 4 chambre...,Appartement de haut standing en vente à hay Riyad. 4 chambre...,360 m²,rabat
1 500 000 DH,Agdal Appartement spacieux à vendre,Agdal Appartement spacieux à vendre,80 m²,rabat
1 750 000 DH,Bel Appartement Pour L'achat Sur Agdal,Bel Appartement Pour L'achat Sur Agdal,89 m²,rabat
2 800 000 DH,Quartier Al Irfane Appart spacieux en vente,Quartier Al Irfane Appart spacieux en vente,135 m²,rabat
12 000 000 DH,Somptueuse maison à vendre à Souissi. 5 chambres agréables...,Somptueuse maison à vendre à Souissi. 5 chambres agréables...,1820 m²,rabat
7 900 000 DH,Appartement à vendre à Souissi. 3 grandes pièces. Meublé,Appartement à vendre à Souissi. 3 grandes pièces. Meublé,320 m²,rabat
12 000 000 DH,Somptueuse villa à vendre à Souissi. 4 chambres. Places de p...,Somptueuse villa à vendre à Souissi. 4 chambres. Places de p...,2050 m²,rabat
1 600 000 DH,Maison Idéalement située,Maison Idéalement située,54 m²,rabat
2 500 000 DH,À vendre à Hay El Menzah – Potentiel exceptionnel après réno...,À vendre à Hay El Menzah – Potentiel exceptionnel après réno...,178 m²,rabat
2 700 000 DH,Vente d'un bel appartement à Agdal. 2 pièces. Meublé,Vente d'un bel appartement à Agdal. 2 pièces. Meublé,160 m²,rabat
4 200 000 DH,Appartement en vente à Souissi,Appartement en vente à Souissi,157 m²,rabat
3 750 000 DH,Très bel appartement à vendre à l'agdal,Très bel appartement à vendre à l'agdal,190 m²,rabat
8 400 000 DH,Villa à vendre,Villa à vendre,500 m²,rabat
1 600 000 DH,"Vente d'un bel appartement à Agdal, Meublé","Vente d'un bel appartement à Agdal, Meublé",70 m²,rabat
3 800 000 DH,Emplacement stratégique pour activité commerciale,Emplacement stratégique pour activité commerciale,110 m²,rabat
1 200 000 DH,Vend appartement 2 ch à Guéliz. Superficie 59 m²,Vend appartement 2 ch à Guéliz. Superficie 59 m²,Vend appartement 2 ch à Guéliz. Superficie 59 m²,marrakech
1 128 000 DH,Vend appartement à Guéliz. Surface de 47 m²,Vend appartement à Guéliz. Surface de 47 m²,Vend appartement à Guéliz. Surface de 47 m²,marrakech
6 700 000 DH,Splendide villa à vendre,Splendide villa à vendre,500 m²,marrakech
5 900 000 DH,Vente Nouvelle Villa Route Ourika,Vente Nouvelle Villa Route Ourika,780 m²,marrakech
4 800 000 DH,Vente Villa Contemporaine à Targa,Vente Villa Contemporaine à Targa,360 m²,marrakech
3 600 000 DH,Vente Villa Très Bonne Affaire Route Tahnaout,Vente Villa Très Bonne Affaire Route Tahnaout,360 m²,marrakech
1 350 000 DH,Magnifique appartement à Route de Casablanca. 84 m² à vendre,Magnifique appartement à Route de Casablanca. 84 m² à vendre,Magnifique appartement à Route de Casablanca. 84 m² à vendre,marrakech
À partir de 890 000 DH,Ouidane Marrakech – Pavillons R+1,IMMOBILIER NEUF,"par le groupe shems al madina vous propose des pavillons r+1 conçus pour allier espace, confort et modernité. avec des superficies à partir de 84 m² et des prix attractifs dès 950 000 dhs, ce programme",marrakech
7 250 000 DH,Vente villa argan golf marrakech,Vente villa argan golf marrakech,298 m²,marrakech
6 400 000 DH,Magnifique villa à vendre à Route de Tahanaout. Surface tota...,Magnifique villa à vendre à Route de Tahanaout. Surface tota...,530 m²,marrakech
1 515 000 DH,Vente d'un bel appartement à Marrakech. Surface de 134 m²,Vente d'un bel appartement à Marrakech. Surface de 134 m²,Vente d'un bel appartement à Marrakech. Surface de 134 m²,marrakech
850 000 DH,Appartement T2 lumineux au nouveau Guéliz,Appartement T2 lumineux au nouveau Guéliz,50 m²,marrakech
3 950 000 DH,Villa de prestige avec vue panoramique sur l’Atlas,Villa de prestige avec vue panoramique sur l’Atlas,294 m²,marrakech
798 000 DH,Superbe appartement à vendre à Izdihar 2 chambres,Superbe appartement à vendre à Izdihar 2 chambres,57 m²,marrakech
4 000 000 DH,Vente Villa Neuve Cherifia,Vente Villa Neuve Cherifia,360 m²,marrakech
5 000 000 DH,Vente Superbe Villa Route Ourika,Vente Superbe Villa Route Ourika,423 m²,marrakech
1 200 000 DH,Vente Terrain Pour Villa à Chérifia,Vente Terrain Pour Villa à Chérifia,460 m²,marrakech
3 750 000 DH,Magnifique Villa Semi finie sur le golf,Magnifique Villa Semi finie sur le golf,380 m²,marrakech
5 070 000 EUR,Vente Villa Contemporaine Route de Fès,Vente Villa Contemporaine Route de Fès,400 m²,marrakech
6 400 000 DH,Vente Villa Contemporaine Front Golf,Vente Villa Contemporaine Front Golf,1000 m²,marrakech
5 600 000 DH,Vente Villa Plain Route Sans vis à vis,Vente Villa Plain Route Sans vis à vis,800 m²,marrakech
5 300 000 DH,Villa 2 niveaux 4 Suites 500 m² en résidence,Villa 2 niveaux 4 Suites 500 m² en résidence,Villa 2 niveaux 4 Suites 500 m² en résidence,marrakech
1 650 000 DH,Appartement Neuf 83 m² à Guéliz avec Salle de Sport,Appartement Neuf 83 m² à Guéliz avec Salle de Sport,Appartement Neuf 83 m² à Guéliz avec Salle de Sport,marrakech
1 650 000 DH,"Appartements neufs à vendre, Guéliz","Appartements neufs à vendre, Guéliz",83 m²,marrakech
460 000 EUR,"Riad titré 3 suites, 2 piscines Marrakech","Riad titré 3 suites, 2 piscines Marrakech",80 m²,marrakech
13 000 DH,Appartement en vente à Plaza. Surface de 100 m². Ascenseur...,Appartement en vente à Plaza. Surface de 100 m². Ascenseur...,Appartement en vente à Plaza. Surface de 100 m². Ascenseur...,marrakech
2 100 000 DH,Appartement sécurisé avec piscine vue dégagée,Appartement sécurisé avec piscine vue dégagée,86 m²,marrakech
2 850 000 DH,URGENT / Duplex à Victor Hugo avec grande cour intérieure,URGENT / Duplex à Victor Hugo avec grande cour intérieure,169 m²,marrakech
1 800 000 DH,Appartement à vendre à Victor Hugo 4 pièces. Ascenseur et pa...,Appartement à vendre à Victor Hugo 4 pièces. Ascenseur et pa...,117 m²,marrakech
1 950 000 DH,Appartement À Vendre Coralia Les Orangers,Appartement À Vendre Coralia Les Orangers,92 m²,marrakech
5 980 000 DH,Villa Prestige moderne et confort,Villa Prestige moderne et confort,1200 m²,marrakech
1 700 000 DH,A Vendre Appartement Duplex Centre Ville Gueliz,A Vendre Appartement Duplex Centre Ville Gueliz,120 m²,marrakech
6 000 000 DH,Appartement en vente à Azli. 3 grandes pièces. Bien meublé,Appartement en vente à Azli. 3 grandes pièces. Bien meublé,58 m²,marrakech
1 128 000 DH,Bel appartement à vendre à Guéliz. Surface de 47 m²,Bel appartement à vendre à Guéliz. Surface de 47 m²,Bel appartement à vendre à Guéliz. Surface de 47 m²,marrakech
6 400 000 DH,Somptueuse villa à vendre à Agdal. 5 chambres agréables,Somptueuse villa à vendre à Agdal. 5 chambres agréables,500 m²,marrakech
818 100 DH,Charmant T2 à vendre Idéal investissement,Charmant T2 à vendre Idéal investissement,45 m²,marrakech
4 500 000 DH,Vente Villa Moderne Avenue Mohamed VI,Vente Villa Moderne Avenue Mohamed VI,300 m²,marrakech
1 250 000 DH,À Vendre – Appartement Spacieux à L Badii,À Vendre – Appartement Spacieux à L Badii,138 m²,marrakech
1 320 000 DH,Appt 2 chambres neuf cœur de Guéliz plaza,Appt 2 chambres neuf cœur de Guéliz plaza,55 m²,marrakech
14 490 000 DH,PALAIS d'HOTES oriental / LUXE / PAS cher,PALAIS d'HOTES oriental / LUXE / PAS cher,1573 m²,marrakech
À partir de 175 000 DH,"Lotissement Jnane El Kheir 1, 2 et 3 à Benguerir",IMMOBILIER NEUF,,marrakech
575 000 EUR,Villa à vendre à Marrakech Golf City Quartier Ménara,Villa à vendre à Marrakech Golf City Quartier Ménara,431 m²,marrakech
6 200 000 DH,Somptueuse maison à vendre à Route de Tahanaout. Surface de...,Somptueuse maison à vendre à Route de Tahanaout. Surface de...,528 m²,marrakech
1 515 000 DH,Vente d'un bel appartement à Marrakech. Surface totale 137 m...,Vente d'un bel appartement à Marrakech. Surface totale 137 m...,137 m²,marrakech
818 100 DH,Appartement 1 chambre Opportunité à saisir,Appartement 1 chambre Opportunité à saisir,45 m²,marrakech
4 400 000 DH,Magnifique villa 4 suites avec vue atlas et piscine privée K...,Magnifique villa 4 suites avec vue atlas et piscine privée K...,338 m²,marrakech
705 000 DH,Studio à vendre à Izdihar Marrakech,Studio à vendre à Izdihar Marrakech,47 m²,marrakech
5 500 000 DH,Route de l'Ourika. Villa haut standing avec piscine,Route de l'Ourika. Villa haut standing avec piscine,478 m²,marrakech
2 700 000 DH,Élégante villa arabo andalouse,Élégante villa arabo andalouse,260 m²,marrakech
1 300 000 DH,Prix très compétitif,Prix très compétitif,95 m²,marrakech
6 200 000 DH,"Spacieuse, Moderne, Lumineuse","Spacieuse, Moderne, Lumineuse",490 m²,marrakech
3 100 000 DH,Magnifique villa semis finie à vendre à Route de Ouarzazate...,Magnifique villa semis finie à vendre à Route de Ouarzazate...,380 m²,marrakech
624 000 DH,Nouveau Projet avec piscine à Marrakech,Nouveau Projet avec piscine à Marrakech,39 m²,marrakech
750 000 DH,Nouveau projet haut standing route de casablanca,Nouveau projet haut standing route de casablanca,35 m²,marrakech
941 000 DH,Projet immobilier neuf a 2 minutes de l’aéroport,Projet immobilier neuf a 2 minutes de l’aéroport,81 m²,marrakech
1 750 000 DH,Jolie appartement à vendre,Jolie appartement à vendre,93 m²,marrakech
2 600 000 DH,Vend appartement à Agdal. Surface totale 88 m². Bien meubl...,Vend appartement à Agdal. Surface totale 88 m². Bien meubl...,Vend appartement à Agdal. Surface totale 88 m². Bien meubl...,marrakech
1 790 000 DH,"Appartement meublé, grande terrasse à Gueliz","Appartement meublé, grande terrasse à Gueliz",90 m²,marrakech
1 080 000 DH,Studio et duplex à L'hivernage avec piscine,Studio et duplex à L'hivernage avec piscine,45 m²,marrakech
8 500 000 DH,Villas haut standing route ourika km10,Villas haut standing route ourika km10,580 m²,marrakech
1 680 000 DH,Superbe appartement à vendre 2 chambres 105 m2,Superbe appartement à vendre 2 chambres 105 m2,105 m²,marrakech
1 368 000 DH,Superbe appartement à vendre à Majorelle. Surface de 76 m²,Superbe appartement à vendre à Majorelle. Surface de 76 m²,Superbe appartement à vendre à Majorelle. Surface de 76 m²,marrakech
400 000 DH,Appartement de 52m² en vente Dyour Al Masjid,Appartement de 52m² en vente Dyour Al Masjid,Appartement de 52m² en vente Dyour Al Masjid,marrakech
1 197 000 DH,Vend appartement à Majorelle. 2 chambres,Vend appartement à Majorelle. 2 chambres,63 m²,marrakech
4 750 000 DH,Magnifique villa à vendre à Route de Tahanaout. 4 belles cha...,Magnifique villa à vendre à Route de Tahanaout. 4 belles cha...,360 m²,marrakech
1 080 300 DH,Vend appartement à Ain mezouar Gueliz,Vend appartement à Ain mezouar Gueliz,78 m²,marrakech
1 347 500 DH,Appartement à l'achat à Guéliz. Surface totale 77 m²,Appartement à l'achat à Guéliz. Surface totale 77 m²,Appartement à l'achat à Guéliz. Surface totale 77 m²,marrakech
5 600 000 DH,Villa de luxe à vendre à Agdal. 5 belles chambres,Villa de luxe à vendre à Agdal. 5 belles chambres,500 m²,marrakech
850 000 DH,Élégant appartement T2 Confort et emplacement idéal,Élégant appartement T2 Confort et emplacement idéal,50 m²,marrakech
900 000 DH,Un magnifique appartement à Zhour Targa,Un magnifique appartement à Zhour Targa,87 m²,marrakech
1 300 000 EUR,Vente villa de luxe à Route de Ouarzazate. 5 chambres confor...,Vente villa de luxe à Route de Ouarzazate. 5 chambres confor...,700 m²,marrakech
5 500 000 DH,Villa marocaine meublée avec piscine à vendre – Style maroca...,Villa marocaine meublée avec piscine à vendre – Style maroca...,480 m²,marrakech
1 250 000 EUR,"Amelkis: Villa à vendre, 5 Ch, Piscine chauffée","Amelkis: Villa à vendre, 5 Ch, Piscine chauffée",550 m²,marrakech
À partir de 175 000 DH,"Lotissement Jnane El Kheir 1, 2 et 3 à Benguerir",IMMOBILIER NEUF,,marrakech
1 090 000 EUR,"Amelkis 1: Villa neuve à vendre en 5 Chs, Piscine","Amelkis 1: Villa neuve à vendre en 5 Chs, Piscine",320 m²,marrakech
6 200 000 DH,Splendide villa à vendre à Route de Tahanaout. 5 chambres ag...,Splendide villa à vendre à Route de Tahanaout. 5 chambres ag...,528 m²,marrakech
1 567 000 DH,Superbe appartement à vendre à Marrakech,Superbe appartement à vendre à Marrakech,137 m²,marrakech
818 100 DH,Charmant appartement 1 chambre à vendre Marrakech,Charmant appartement 1 chambre à vendre Marrakech,45 m²,marrakech
5 490 000 DH,"Villa d'exception, Rte Ourika, 4 suites vue Atlas","Villa d'exception, Rte Ourika, 4 suites vue Atlas",338 m²,marrakech
1 036 000 DH,Bel appartement à vendre à Izdihar 2 chambres,Bel appartement à vendre à Izdihar 2 chambres,74 m²,marrakech
4 900 000 DH,"Villa en 3 niveaux avec piscine et cave, 6 chambres 570 m²","Villa en 3 niveaux avec piscine et cave, 6 chambres 570 m²","Villa en 3 niveaux avec piscine et cave, 6 chambres 570 m²",marrakech
1 400 000 DH,A Vendre à River Palm Palmeraie sur la route de Casablanca. ...,A Vendre à River Palm Palmeraie sur la route de Casablanca. ...,100 m²,marrakech
1 300 000 DH,Bel Appartement avec Terrasse dans Résidence Sécur,Bel Appartement avec Terrasse dans Résidence Sécur,82 m²,marrakech
1 290 000 EUR,SUBLIME Maison d'hôtes / VNA OK,SUBLIME Maison d'hôtes / VNA OK,775 m²,marrakech
1 200 000 DH,Vend appartement à Riad Al Atlas. 2 pièces confortables,Vend appartement à Riad Al Atlas. 2 pièces confortables,48 m²,marrakech
1 300 000 DH,Appartement en vente à Riad Al Atlas. 1 chambre. Meublé,Appartement en vente à Riad Al Atlas. 1 chambre. Meublé,55 m²,marrakech
460 000 EUR,Vente villa à km 27 route ourika,Vente villa à km 27 route ourika,2792 m²,marrakech
400 000 EUR,Vente Riad Renover Avec Bassin A Mouassine,Vente Riad Renover Avec Bassin A Mouassine,100 m²,marrakech
340 000 EUR,Vente Riad Rénover titré 3chambres à Sidi Mimoun,Vente Riad Rénover titré 3chambres à Sidi Mimoun,57 m²,marrakech
580 000 EUR,Vente riad titré plus proche du riad laarous,Vente riad titré plus proche du riad laarous,119 m²,marrakech
645 000 DH,Magnifique Studio en vente à route de Casablanca,Magnifique Studio en vente à route de Casablanca,43 m²,marrakech
882 000 DH,Appartement en vente à Bouaakkaz. 2 chambres agréables,Appartement en vente à Bouaakkaz. 2 chambres agréables,80 m²,marrakech
3 480 000 DH,Villa de haut standing à vendre à Route Casablanca. 4 chambr...,Villa de haut standing à vendre à Route Casablanca. 4 chambr...,260 m²,marrakech
400 000 DH,Appartement de 52m² en vente Dyour Al Masjid,Appartement de 52m² en vente Dyour Al Masjid,Appartement de 52m² en vente Dyour Al Masjid,marrakech
3 990 000 DH,Splendide villa à vendre à Route de l'Ourika. 5 pièces,Splendide villa à vendre à Route de l'Ourika. 5 pièces,294 m²,marrakech
4 900 000 DH,Maison de luxe à vendre à Route Casablanca. Surface de 414 m...,Maison de luxe à vendre à Route Casablanca. Surface de 414 m...,410 m²,marrakech
9 550 000 DH,Vente villa de luxe à Route de l'Ourika. 5 belles chambres,Vente villa de luxe à Route de l'Ourika. 5 belles chambres,935 m²,marrakech
12 000 000 DH,Splendide villa à vendre à Route de Ouarzazate. Superficie 9...,Splendide villa à vendre à Route de Ouarzazate. Superficie 9...,955 m²,marrakech
36 000 000 DH,Superbe appartement à vendre à Boulevard Med 6.3 belles cham...,Superbe appartement à vendre à Boulevard Med 6.3 belles cham...,282 m²,marrakech
1 258 000 DH,Duplex à l'achat à Guéliz. Surface 44 m² au RDC et 30 à la M...,Duplex à l'achat à Guéliz. Surface 44 m² au RDC et 30 à la M...,Duplex à l'achat à Guéliz. Surface 44 m² au RDC et 30 à la M...,marrakech
5 600 000 DH,Somptueuse maison à vendre à Agdal. Surface totale 500 m²,Somptueuse maison à vendre à Agdal. Surface totale 500 m²,Somptueuse maison à vendre à Agdal. Surface totale 500 m²,marrakech
1 260 000 DH,Vente d'un bel appartement à Guéliz. 2 belles chambres,Vente d'un bel appartement à Guéliz. 2 belles chambres,70 m²,marrakech
1 400 000 DH,Achat vente appartement Guéliz Marrakech,Achat vente appartement Guéliz Marrakech,54 m²,marrakech
1 800 000 DH,Achat vente appartement piscine majorelle marrakec,Achat vente appartement piscine majorelle marrakec,90 m²,marrakech
3 800 000 DH,Beau riad 130 m 2 en vente à Marrakech,Beau riad 130 m 2 en vente à Marrakech,160 m²,marrakech
4 500 000 DH,Splendide villa à vendre à Route de FES,Splendide villa à vendre à Route de FES,1200 m²,marrakech
À partir de 1 515 000 DH,Le Vizir - Appartements de standing à Marrakech,IMMOBILIER NEUF,,marrakech
4 200 000 DH,Villa d’Exception avec Piscine et Vue sur l’Atlas,Villa d’Exception avec Piscine et Vue sur l’Atlas,267 m²,marrakech
6 200 000 DH,Somptueuse villa à vendre à Route de Tahanaout. 9 pièces con...,Somptueuse villa à vendre à Route de Tahanaout. 9 pièces con...,528 m²,marrakech
1 515 000 DH,Bel appartement à vendre à Marrakech,Bel appartement à vendre à Marrakech,134 m²,marrakech
818 100 DH,Bel T2 de 45 m² à vendre au Nouveau Guéliz,Bel T2 de 45 m² à vendre au Nouveau Guéliz,Bel T2 de 45 m² à vendre au Nouveau Guéliz,marrakech
4 400 000 DH,Villa d’exception 4 suites – Vue Atlas. Rte Ourika KM7,Villa d’exception 4 suites – Vue Atlas. Rte Ourika KM7,338 m²,marrakech
1 050 000 DH,Appartement de 75 m² à route de Casablanca,Appartement de 75 m² à route de Casablanca,Appartement de 75 m² à route de Casablanca,marrakech
395 000 EUR,Vente Riad en réquisition À Bab Doukkala,Vente Riad en réquisition À Bab Doukkala,60 m²,marrakech
Prix à consulter,Vente Riad neuf de prestige avec 3 suites à kasbah,Vente Riad neuf de prestige avec 3 suites à kasbah,450 m²,marrakech
500 000 EUR,Vente Riad titré avec bassin à kasbah Médina,Vente Riad titré avec bassin à kasbah Médina,200 m²,marrakech
4 000 000 DH,Appartement à l'achat à Hivernage. Surface de 200 m². Meub...,Appartement à l'achat à Hivernage. Surface de 200 m². Meub...,Appartement à l'achat à Hivernage. Surface de 200 m². Meub...,marrakech
1 080 000 DH,Luxe Studio avec Terrasse,Luxe Studio avec Terrasse,50 m²,marrakech
1 200 000 DH,Appartement en vente el Massira 1,Appartement en vente el Massira 1,110 m²,marrakech
2 500 000 DH,Apprt meublé rez de jardin à vendre Prestigia kech,Apprt meublé rez de jardin à vendre Prestigia kech,77 m²,marrakech
1 600 000 DH,Appartement Neuf 84 m² à Guéliz,Appartement Neuf 84 m² à Guéliz,Appartement Neuf 84 m² à Guéliz,marrakech
6 890 000 DH,SOFIA / près du QUICK / pas de VIS A VIS,SOFIA / près du QUICK / pas de VIS A VIS,730 m²,marrakech
Prix à consulter,Vente appartement 2 chambres prestigia golf city Marrakech p...,Vente appartement 2 chambres prestigia golf city Marrakech p...,75 m²,marrakech
1 395 200 DH,Vente d'un bel appartement. 3 chambres agréables,Vente d'un bel appartement. 3 chambres agréables,109 m²,marrakech
846 000 DH,Superbe appartement à vendre à Majorelle. Surface de 47 m²,Superbe appartement à vendre à Majorelle. Surface de 47 m²,Superbe appartement à vendre à Majorelle. Surface de 47 m²,marrakech
1 130 000 DH,Bel appartement T3 de 65 m² Confort & emplacement privilégié,Bel appartement T3 de 65 m² Confort & emplacement privilégié,Bel appartement T3 de 65 m² Confort & emplacement privilégié,marrakech
1 200 000 DH,Opportunité à saisir d'un appartement en vente allal fassi,Opportunité à saisir d'un appartement en vente allal fassi,120 m²,marrakech
3 600 000 DH,Très beau riad à vendre 169 m² à Marrakech Médina avec 7 gra...,Très beau riad à vendre 169 m² à Marrakech Médina avec 7 gra...,Très beau riad à vendre 169 m² à Marrakech Médina avec 7 gra...,marrakech
8 000 000 DH,Villa de luxe à vendre à Route de Tahanaout. 4 belles chambr...,Villa de luxe à vendre à Route de Tahanaout. 4 belles chambr...,1000 m²,marrakech
4 200 000 DH,"Villas plain pied 500m² de 4 suites, livrées fin 2026","Villas plain pied 500m² de 4 suites, livrées fin 2026","Villas plain pied 500m² de 4 suites, livrées fin 2026",marrakech
Prix à consulter,Appartement à vendre bd abdelkarim khattabi,Appartement à vendre bd abdelkarim khattabi,81 m²,marrakech
750 000 DH,Superbe opportunité d’acquisition — Appartement avec terrass...,Superbe opportunité d’acquisition — Appartement avec terrass...,67 m²,marrakech
1 819 000 DH,Duplex en vente GUELIZ Surface de 72 m² RDC et 35 MEZ,Duplex en vente GUELIZ Surface de 72 m² RDC et 35 MEZ,Duplex en vente GUELIZ Surface de 72 m² RDC et 35 MEZ,marrakech
5 000 000 DH,Vente villa de luxe à Agdal. 5 chambres agréables,Vente villa de luxe à Agdal. 5 chambres agréables,500 m²,marrakech
1 242 000 DH,Vente d'un bel appartement à Route Casablanca. Surface de 69...,Vente d'un bel appartement à Route Casablanca. Surface de 69...,69 m²,marrakech
13 000 000 DH,À vendre – Villa d’exception front Golf Amelkis,À vendre – Villa d’exception front Golf Amelkis,260 m²,marrakech
1 500 000 DH,Appartement à vendre,Appartement à vendre,,marrakech
4 300 000 DH,Projet Mirvana – 62 villas plain pied haut standing,Projet Mirvana – 62 villas plain pied haut standing,729 m²,marrakech
2 300 000 DH,Appartement de luxe 2 chambre meublè,Appartement de luxe 2 chambre meublè,78 m²,marrakech
À partir de 1 515 000 DH,Le Vizir - Appartements de standing à Marrakech,IMMOBILIER NEUF,,marrakech
7 900 000 DH,Magnifique Riad a titré 290 m au kasba,Magnifique Riad a titré 290 m au kasba,290 m²,marrakech
6 200 000 DH,Magnifique villa à vendre à Route de Tahanaout,Magnifique villa à vendre à Route de Tahanaout,528 m²,marrakech
