prix,titre,lieu,surface,ville_scrape
818 100 DH,"T2 moderne et bien situé à Guéliz, Marrakech","T2 moderne et bien situé à Guéliz, Marrakech",45 m²,marrakech
3 900 000 DH,Residence privée route Ourika KM5,Residence privée route Ourika KM5,294 m²,marrakech
980 000 DH,Appartement à vendre à Izdihar 70 m²,Appartement à vendre à Izdihar 70 m²,Appartement à vendre à Izdihar 70 m²,marrakech
9 200 000 DH,"Villa Ultra luxe: 4 Suites, Piscine chauffée 18m – Vue Atlas","Villa Ultra luxe: 4 Suites, Piscine chauffée 18m – Vue Atlas",1050 m²,marrakech
2 200 000 DH,Guéliz Appartement 2 chambres à vendre,Guéliz Appartement 2 chambres à vendre,108 m²,marrakech
1 100 000 DH,Idéal investisseur. Appartement 1ch salon,Idéal investisseur. Appartement 1ch salon,49 m²,marrakech
2 625 000 DH,Appartement 2 chambres Palmeraie Golf 144M²,Appartement 2 chambres Palmeraie Golf 144M²,144 m²,marrakech
8 690 000 DH,Exploitée MAISON d'HOTES et VNA ok,Exploitée MAISON d'HOTES et VNA ok,474 m²,marrakech
1 950 000 DH,À Vendre – Bel Appartement au cœur de Guéliz,À Vendre – Bel Appartement au cœur de Guéliz,114 m²,marrakech
5 500 000 DH,Riad ruine 350 m 2 en vente à Marrakech,Riad ruine 350 m 2 en vente à Marrakech,400 m²,marrakech
2 400 000 DH,Riad en vente 114 m2 à Marrakech,Riad en vente 114 m2 à Marrakech,140 m²,marrakech
5 000 000 DH,Authentique riad 285 m 2 en vente à Marrakech,Authentique riad 285 m 2 en vente à Marrakech,320 m²,marrakech
2 650 000 DH,Moderne appartement à vendre à Prestigia,Moderne appartement à vendre à Prestigia,85 m²,marrakech
1 700 000 DH,Bel Appartement vide à vendre à Majorelle,Bel Appartement vide à vendre à Majorelle,137 m²,marrakech
6 400 000 DH,Somptueuse maison à vendre à Route de Tahanaout,Somptueuse maison à vendre à Route de Tahanaout,530 m²,marrakech
846 000 DH,Appartement en vente à Majorelle. Surface de 47 m²,Appartement en vente à Majorelle. Surface de 47 m²,Appartement en vente à Majorelle. Surface de 47 m²,marrakech
460 000 DH,Appartement de 72m² en vente Dyour Al Masjid,Appartement de 72m² en vente Dyour Al Masjid,Appartement de 72m² en vente Dyour Al Masjid,marrakech
7 500 000 DH,Villa de luxe à vendre avec VNA à Route de Fez. 10 belles ch...,Villa de luxe à vendre avec VNA à Route de Fez. 10 belles ch...,5000 m²,marrakech
8 200 000 DH,Splendide villa à vendre à Route de Tahanaout. 11 grandes p...,Splendide villa à vendre à Route de Tahanaout. 11 grandes p...,600 m²,marrakech
2 800 000 DH,Vend duplex à Camp Al Ghoul. 3 chambres agréables. Meublé,Vend duplex à Camp Al Ghoul. 3 chambres agréables. Meublé,169 m²,marrakech
3 800 000 DH,Magnifique villa à vendre 485 m² à Zhour Targa à Marrakech,Magnifique villa à vendre 485 m² à Zhour Targa à Marrakech,Magnifique villa à vendre 485 m² à Zhour Targa à Marrakech,marrakech
1 098 000 DH,Appartement à vendre à Majorelle. Surface totale 61 m²,Appartement à vendre à Majorelle. Surface totale 61 m²,Appartement à vendre à Majorelle. Surface totale 61 m²,marrakech
5 000 000 DH,Villa a kenza,Villa a kenza,285 m²,marrakech
943 500 DH,Appartement en vente à Guéliz 1 belle chambre,Appartement en vente à Guéliz 1 belle chambre,51 m²,marrakech
5 300 000 DH,Splendide villa à vendre à Agdal. 5 chambres,Splendide villa à vendre à Agdal. 5 chambres,500 m²,marrakech
2 680 000 DH,Bel appartement à vendre à Route Casablanca. Superficie 134...,Bel appartement à vendre à Route Casablanca. Superficie 134...,134 m²,marrakech
3 300 000 DH,Un ancien Riad en ruine au cœur de la Palmeraie,Un ancien Riad en ruine au cœur de la Palmeraie,360 m²,marrakech
1 770 000 EUR,"URGENT – OFF MARKET, Villa de Luxe Amelkis Marrakech, Produi...","URGENT – OFF MARKET, Villa de Luxe Amelkis Marrakech, Produi...",701 m²,marrakech
3 600 000 DH,Appartement 3 chambres avec piscine et parking à vendre à Ma...,Appartement 3 chambres avec piscine et parking à vendre à Ma...,137 m²,marrakech
18 000 000 EUR,Palais d’Exception à Vendre – Palmeraie Domaine de ***-****...,Palais d’Exception à Vendre – Palmeraie Domaine de ***-****...,38000 m²,marrakech
À partir de 1 515 000 DH,Le Vizir - Appartements de standing à Marrakech,IMMOBILIER NEUF,,marrakech
750 000 EUR,Splendide villa à vendre à Route de l'Ourika. 4 belles chamb...,Splendide villa à vendre à Route de l'Ourika. 4 belles chamb...,580 m²,marrakech
6 200 000 DH,Magnifique villa à vendre à Route de Tahanaout. 5 belles cha...,Magnifique villa à vendre à Route de Tahanaout. 5 belles cha...,528 m²,marrakech
3 990 000 DH,"Villa d'exception, 4 suites, KM5 Route de l'Ourika","Villa d'exception, 4 suites, KM5 Route de l'Ourika",294 m²,marrakech
9 350 000 DH,"Villa Ultra luxe: 4 Suites, Vue Atlas, Piscine 18m Chauffée","Villa Ultra luxe: 4 Suites, Vue Atlas, Piscine 18m Chauffée",1075 m²,marrakech
1 254 000 DH,Appartement à l'achat à Majorelle. Surface totale 66 m²,Appartement à l'achat à Majorelle. Surface totale 66 m²,Appartement à l'achat à Majorelle. Surface totale 66 m²,marrakech
6 759 000 DH,Somptueuse villa à vendre à Route de Fez. 4 chambres agréabl...,Somptueuse villa à vendre à Route de Fez. 4 chambres agréabl...,1502 m²,marrakech
2 650 000 DH,Riad / Triplex de charme à vendre Qariya Siyahiya,Riad / Triplex de charme à vendre Qariya Siyahiya,195 m²,marrakech
6 900 000 DH,Vente villa moderne,Vente villa moderne,484 m²,marrakech
6 000 000 DH,Coup de coeur. À deux pas de la Medersa Ben Youssef,Coup de coeur. À deux pas de la Medersa Ben Youssef,210 m²,marrakech
Prix à consulter,"Riad à rafraichir 3 chambres emplacement n1, Kennaria","Riad à rafraichir 3 chambres emplacement n1, Kennaria",180 m²,marrakech
6 500 000 DH,Maison d&rsquo; hôtes de 5 chambres / 2 bassins,Maison d&rsquo; hôtes de 5 chambres / 2 bassins,250 m²,marrakech
1 270 000 DH,Bel appartement à vendre à Guéliz. Surface totale 62 m². P...,Bel appartement à vendre à Guéliz. Surface totale 62 m². P...,Bel appartement à vendre à Guéliz. Surface totale 62 m². P...,marrakech
1 030 000 DH,Appartement 75 m2 5eme étage sans vis à vis,Appartement 75 m2 5eme étage sans vis à vis,75 m²,marrakech
6 000 000 DH,Vente villa 9 chambres route Ouarzazate Marrakech,Vente villa 9 chambres route Ouarzazate Marrakech,580 m²,marrakech
1 215 000 DH,Un nouveau projet au cœur de quartier Géulize a Marrakech,Un nouveau projet au cœur de quartier Géulize a Marrakech,45 m²,marrakech
2 100 000 DH,Un nouveau projet au cœur de quartier Géulize à Marrakech,Un nouveau projet au cœur de quartier Géulize à Marrakech,84 m²,marrakech
460 000 DH,Appartement de 72m² en vente Dyour Al Masjid,Appartement de 72m² en vente Dyour Al Masjid,Appartement de 72m² en vente Dyour Al Masjid,marrakech
1 950 000 DH,Appartement à vendre à Majorelle. 2 belles chambres. Ascense...,Appartement à vendre à Majorelle. 2 belles chambres. Ascense...,130 m²,marrakech
2 500 000 DH,Appartement à vendre à Guéliz. Surface totale 120 m². Meublé,Appartement à vendre à Guéliz. Surface totale 120 m². Meublé,Appartement à vendre à Guéliz. Surface totale 120 m². Meublé,marrakech
1 394 000 DH,Duplex avec piscine à vendre Gueliz,Duplex avec piscine à vendre Gueliz,82 m²,marrakech
5 250 000 DH,Maison de luxe à vendre à Route de l'Ourika. 3 grandes pièc...,Maison de luxe à vendre à Route de l'Ourika. 3 grandes pièc...,240 m²,marrakech
3 600 000 DH,Joli riad 116 m 2 titré en vente à Marrakech,Joli riad 116 m 2 titré en vente à Marrakech,140 m²,marrakech
1 098 000 DH,Vend appartement à Majorelle. 2 belles chambres,Vend appartement à Majorelle. 2 belles chambres,61 m²,marrakech
2 450 000 DH,Appartement à vendre,Appartement à vendre,95 m²,marrakech
2 400 000 DH,Riad titré 80 m 2 en vente à Marrakech,Riad titré 80 m 2 en vente à Marrakech,120 m²,marrakech
5 300 000 DH,Villa de haut standing semi finie à vendre à Agdal. Surface...,Villa de haut standing semi finie à vendre à Agdal. Surface...,500 m²,marrakech
810 000 DH,Bel appartement à vendre à Route Casablanca. Surface de 45 m...,Bel appartement à vendre à Route Casablanca. Surface de 45 m...,45 m²,marrakech
490 000 DH,Appartement moderne à M’Hamid 9,Appartement moderne à M’Hamid 9,58 m²,marrakech
825 000 EUR,"Villa Contemporaine de Luxe à Vendre – Avenue Mohammed VI, M...","Villa Contemporaine de Luxe à Vendre – Avenue Mohammed VI, M...",764 m²,marrakech
1 570 000 DH,Duplex Rez de chaussée d’exception avec parking titré – Rési...,Duplex Rez de chaussée d’exception avec parking titré – Rési...,86 m²,marrakech
5 600 000 DH,Villa style Riad à la vente à Agdal. 5 belles chambres. Meub...,Villa style Riad à la vente à Agdal. 5 belles chambres. Meub...,350 m²,marrakech
38 000 000 DH,Villa d’exception – triangle d’or palmeraie – produit rare &...,Villa d’exception – triangle d’or palmeraie – produit rare &...,1500 m²,marrakech
À partir de 1 515 000 DH,Le Vizir - Appartements de standing à Marrakech,IMMOBILIER NEUF,,marrakech
25 000 000 DH,Villa d’Exception Vue sur le Golf AL MAADEN,Villa d’Exception Vue sur le Golf AL MAADEN,1000 m²,marrakech
5 800 000 DH,Somptueuse villa à vendre à Route de Tahanaout. 5 belles cha...,Somptueuse villa à vendre à Route de Tahanaout. 5 belles cha...,500 m²,marrakech
3 900 000 DH,"Villa haut standing 4 suites, Rte Ourika KM5","Villa haut standing 4 suites, Rte Ourika KM5",294 m²,marrakech
10 000 000 DH,"Villa Ultra luxe: 4 Suites, Vue Atlas, Piscine Chauffée de 1...","Villa Ultra luxe: 4 Suites, Vue Atlas, Piscine Chauffée de 1...",1250 m²,marrakech
969 000 DH,Appartement à vendre à Majorelle. Surface de 51 m²,Appartement à vendre à Majorelle. Surface de 51 m²,Appartement à vendre à Majorelle. Surface de 51 m²,marrakech
6 363 000 DH,Villa de haut standing à vendre à Route de Fez. 4 chambres,Villa de haut standing à vendre à Route de Fez. 4 chambres,1414 m²,marrakech
250 000 EUR,Superbe Appartement meublé vue piscine à Noria,Superbe Appartement meublé vue piscine à Noria,85 m²,marrakech
3 860 000 DH,Grand appartement neuf 193m² 3 chambres au centre,Grand appartement neuf 193m² 3 chambres au centre,Grand appartement neuf 193m² 3 chambres au centre,marrakech
3 800 000 DH,Villa avec piscine a targa,Villa avec piscine a targa,274 m²,marrakech
6 500 000 DH,Villa avec Vue Panoramique sur l’Atlas,Villa avec Vue Panoramique sur l’Atlas,1000 m²,marrakech
1 000 000 EUR,Villa de haut standing à vendre – Atlas Nakhil,Villa de haut standing à vendre – Atlas Nakhil,420 m²,marrakech
850 000 EUR,Villa de standing à vendre – Domaine d’Amelkis,Villa de standing à vendre – Domaine d’Amelkis,600 m²,marrakech
4 500 000 DH,Villa contemporaine en vente,Villa contemporaine en vente,240 m²,marrakech
1 500 000 DH,Appartement lumineux avec balcons-Route Casablanca,Appartement lumineux avec balcons-Route Casablanca,94 m²,marrakech
650 000 EUR,"Villa avec VNA route de l'Ourika, vue Atlas","Villa avec VNA route de l'Ourika, vue Atlas",460 m²,marrakech
4 600 000 DH,Villa d’Exception à la Vente – Proche Amelkis,Villa d’Exception à la Vente – Proche Amelkis,240 m²,marrakech
16 000 DH,Studios et Appartements de prestige dans une résidence de lu...,Studios et Appartements de prestige dans une résidence de lu...,39 m²,marrakech
1 200 000 DH,Projet de Reconstruction a vendre MELLAH MARRAKEC,Projet de Reconstruction a vendre MELLAH MARRAKEC,96 m²,marrakech
737 000 DH,Des appartements neufs a Bouaakaz Chrifia SUP de 67 m² a 87...,Des appartements neufs a Bouaakaz Chrifia SUP de 67 m² a 87...,Des appartements neufs a Bouaakaz Chrifia SUP de 67 m² a 87...,marrakech
5 200 000 DH,"Villas Prestige: 4 Ch, Piscine, domotique & Padel","Villas Prestige: 4 Ch, Piscine, domotique & Padel",500 m²,marrakech
855 000 DH,Duplex une chambre 46M² à Guéliz,Duplex une chambre 46M² à Guéliz,46 m²,marrakech
6 900 000 DH,Bonne affaire à saisir villa presque terminé dans une petite...,Bonne affaire à saisir villa presque terminé dans une petite...,793 m²,marrakech
3 890 000 DH,Somptueuse villa à vendre à Route de l'Ourika. 4 chambres,Somptueuse villa à vendre à Route de l'Ourika. 4 chambres,294 m²,marrakech
5 000 000 DH,Villa de luxe à vendre à Route de Tahanaout. Superficie 403...,Villa de luxe à vendre à Route de Tahanaout. Superficie 403...,403 m²,marrakech
1 550 000 DH,Appartement à Gueliz,Appartement à Gueliz,110 m²,marrakech
5 100 000 DH,Maison de luxe semi finie à vendre à Agdal,Maison de luxe semi finie à vendre à Agdal,500 m²,marrakech
840 000 DH,Appartement de qualité à M’Hamid 9,Appartement de qualité à M’Hamid 9,110 m²,marrakech
8 290 000 DH,Maison de haut standing à vendre à Route Amizmiz. 4 belles c...,Maison de haut standing à vendre à Route Amizmiz. 4 belles c...,338 m²,marrakech
1 650 000 DH,Appartement Neuf 84 m² à Guéliz,Appartement Neuf 84 m² à Guéliz,Appartement Neuf 84 m² à Guéliz,marrakech
6 285 000 DH,Villa de Charme Route de l'ourika,Villa de Charme Route de l'ourika,335 m²,marrakech
13 000 000 DH,Domaine d’Exception de 4 Hectares avec 4 Villas Semi Finies...,Domaine d’Exception de 4 Hectares avec 4 Villas Semi Finies...,40000 m²,marrakech
2 690 000 DH,Magnifique appartement ouvert sur de grandes terrasses offra...,Magnifique appartement ouvert sur de grandes terrasses offra...,145 m²,marrakech
À partir de 175 000 DH,"Lotissement Jnane El Kheir 1, 2 et 3 à Benguerir",IMMOBILIER NEUF,,marrakech
16 000 000 DH,Restaurant lounge à vendre sur la Route de l'Ourika. Petite...,Restaurant lounge à vendre sur la Route de l'Ourika. Petite...,1285 m²,marrakech
6 400 000 DH,Vente villa de luxe à Route de Tahanaout. 5 chambres. Jardin...,Vente villa de luxe à Route de Tahanaout. 5 chambres. Jardin...,500 m²,marrakech
4 990 000 DH,"Villa d’exception 4 suites – Vue imprenable sur l’Atlas, Rou...","Villa d’exception 4 suites – Vue imprenable sur l’Atlas, Rou...",338 m²,marrakech
9 900 000 DH,Villa Ultra luxe: 4 Suites & Piscine chauffée 18m – Vue Atla,Villa Ultra luxe: 4 Suites & Piscine chauffée 18m – Vue Atla,1255 m²,marrakech
1 634 000 DH,Vend appartement à Majorelle. Superficie 86 m²,Vend appartement à Majorelle. Superficie 86 m²,Vend appartement à Majorelle. Superficie 86 m²,marrakech
6 804 000 DH,Maison de luxe à vendre à Route de Fez. 4 chambres agréables,Maison de luxe à vendre à Route de Fez. 4 chambres agréables,1512 m²,marrakech
330 000 EUR,Villa Plain Pied 130m² avec Piscine & Vue Atlas,Villa Plain Pied 130m² avec Piscine & Vue Atlas,Villa Plain Pied 130m² avec Piscine & Vue Atlas,marrakech
350 000 EUR,Villa individuelle avec jardin et piscine chauffée,Villa individuelle avec jardin et piscine chauffée,100 m²,marrakech
4 600 000 DH,Villa Meublée à Vendre – Proche Amelkis,Villa Meublée à Vendre – Proche Amelkis,280 m²,marrakech
550 000 EUR,VIDEO: Riad arty au charme marocain à la Kasbah,VIDEO: Riad arty au charme marocain à la Kasbah,180 m²,marrakech
830 000 EUR,"Kasbah de 1,7 Hectare avec un Lac","Kasbah de 1,7 Hectare avec un Lac",17000 m²,marrakech
515 000 EUR,Rare a la vente: villa 3 suites avec piscine,Rare a la vente: villa 3 suites avec piscine,338 m²,marrakech
4 500 000 DH,Villa isolée au style traditionnel à Marrakech,Villa isolée au style traditionnel à Marrakech,620 m²,marrakech
2 400 000 DH,Très bel apprte meublé prestigia agate à vendre,Très bel apprte meublé prestigia agate à vendre,80 m²,marrakech
Prix à consulter,Apparte à vendre à guékiz,Apparte à vendre à guékiz,106 m²,marrakech
5 000 000 DH,Splendide villa à la vente sur la route de l ourika km 10,Splendide villa à la vente sur la route de l ourika km 10,400 m²,marrakech
22 000 000 DH,Somptueuse maison à vendre à Route de Fez. Superficie 2271 m...,Somptueuse maison à vendre à Route de Fez. Superficie 2271 m...,2271 m²,marrakech
8 090 000 DH,Magnifique villa à vendre à Route Amizmiz. Superficie 338 m²,Magnifique villa à vendre à Route Amizmiz. Superficie 338 m²,Magnifique villa à vendre à Route Amizmiz. Superficie 338 m²,marrakech
3 890 000 DH,Villa de haut standing à vendre à Route de l'Ourika. 4 chamb...,Villa de haut standing à vendre à Route de l'Ourika. 4 chamb...,294 m²,marrakech
1 225 000 DH,Bel appartement de 75 m² à vendre au Nouveau Gueliz Guéliz,Bel appartement de 75 m² à vendre au Nouveau Gueliz Guéliz,Bel appartement de 75 m² à vendre au Nouveau Gueliz Guéliz,marrakech
750 000 DH,Appartement à Vendre situé à coté de Macdonald,Appartement à Vendre situé à coté de Macdonald,60 m²,marrakech
2 400 000 DH,Opportunité exceptionnelle à saisir sur Marrakech,Opportunité exceptionnelle à saisir sur Marrakech,177 m²,marrakech
2 300 000 DH,Très bon affaire à nous pas rater sur Marrakech,Très bon affaire à nous pas rater sur Marrakech,84 m²,marrakech
620 000 EUR,Vente Riad Rénover titré 7chambres à Zaouia Abasia,Vente Riad Rénover titré 7chambres à Zaouia Abasia,230 m²,marrakech
580 000 EUR,Vente Riad Meublé 4 Chambres À La Kasbah,Vente Riad Meublé 4 Chambres À La Kasbah,93 m²,marrakech
5 100 000 DH,Villa de haut standing à vendre à Agdal. 5 chambres,Villa de haut standing à vendre à Agdal. 5 chambres,500 m²,marrakech
480 000 DH,Appartement haut standing à M’Hamid 9,Appartement haut standing à M’Hamid 9,58 m²,marrakech
7 990 000 DH,Villa de luxe à vendre à Route Amizmiz. Surface de 338 m²,Villa de luxe à vendre à Route Amizmiz. Surface de 338 m²,Villa de luxe à vendre à Route Amizmiz. Surface de 338 m²,marrakech
7 500 000 DH,Somptueuse villa à vendre à Route de Tahanaout,Somptueuse villa à vendre à Route de Tahanaout,400 m²,marrakech
2 610 000 DH,Appartement Neuf de 154 m² à Guéliz,Appartement Neuf de 154 m² à Guéliz,Appartement Neuf de 154 m² à Guéliz,marrakech
6 200 000 DH,Villa à vendre,Villa à vendre,449 m²,marrakech
6 300 000 DH,Villa à vendre noria golf,Villa à vendre noria golf,335 m²,marrakech
À partir de 1 515 000 DH,Le Vizir - Appartements de standing à Marrakech,IMMOBILIER NEUF,,marrakech
148 000 EUR,Appartement à vendre – la Palmeraie,Appartement à vendre – la Palmeraie,85 m²,marrakech
4 490 000 DH,"Villa 4 suites, vue Atlas exceptionnel, KM5 route de l'Ourik...","Villa 4 suites, vue Atlas exceptionnel, KM5 route de l'Ourik...",338 m²,marrakech
12 000 000 DH,"Villa Ultra Luxe: 5 Suites, Cinéma, Salle de sport, Hammam &...","Villa Ultra Luxe: 5 Suites, Cinéma, Salle de sport, Hammam &...",1250 m²,marrakech
1 026 000 DH,Appartement en vente à Majorelle. Surface de 57 m²,Appartement en vente à Majorelle. Surface de 57 m²,Appartement en vente à Majorelle. Surface de 57 m²,marrakech
7 204 500 DH,Somptueuse villa à vendre à Route de Fez. Superficie 1601 m²,Somptueuse villa à vendre à Route de Fez. Superficie 1601 m²,Somptueuse villa à vendre à Route de Fez. Superficie 1601 m²,marrakech
908 500 DH,Bel appartement à vendre à El Hara. 1 belle chambre,Bel appartement à vendre à El Hara. 1 belle chambre,32 m²,marrakech
9 000 000 DH,Villa de luxe a prestigia golf city de 3 facade,Villa de luxe a prestigia golf city de 3 facade,1000 m²,marrakech
2 900 000 DH,Splendide apprt 3 chs prestigia,Splendide apprt 3 chs prestigia,100 m²,marrakech
16 500 000 DH,Vend appartement à Guéliz. Surface totale 95 m². Meublé,Vend appartement à Guéliz. Surface totale 95 m². Meublé,Vend appartement à Guéliz. Surface totale 95 m². Meublé,marrakech
2 109 000 EUR,Maison d’Hôtes de caractère à Vendre,Maison d’Hôtes de caractère à Vendre,1000 m²,marrakech
890 000 EUR,Maison de Caractère à Vendre – Proche Ecole Américaine,Maison de Caractère à Vendre – Proche Ecole Américaine,300 m²,marrakech
8 000 DH,Appartement plein sud 85m avec terrasse situé à la Palmeraie,Appartement plein sud 85m avec terrasse situé à la Palmeraie,85 m²,marrakech
7 800 000 DH,Villa De prestige Golf Noria,Villa De prestige Golf Noria,591 m²,marrakech
6 000 000 DH,Villa de haut standing à vendre à Route Amizmiz. Superficie...,Villa de haut standing à vendre à Route Amizmiz. Superficie...,360 m²,marrakech
3 200 000 DH,Appartement de luxe – Prestigia Opal – Rez de jardin,Appartement de luxe – Prestigia Opal – Rez de jardin,110 m²,marrakech
2 250 000 DH,Joli appartement à vendre meublé à Noria,Joli appartement à vendre meublé à Noria,84 m²,marrakech
1 200 000 EUR,Vente villa d'hôte a 18km route casablanca,Vente villa d'hôte a 18km route casablanca,900 m²,marrakech
600 000 EUR,Riad Rénové Titré 3 chambres À Bab Doukala,Riad Rénové Titré 3 chambres À Bab Doukala,110 m²,marrakech
2 360 000 DH,Appartement avec belle terrasse à vendre en plein Guéliz – à...,Appartement avec belle terrasse à vendre en plein Guéliz – à...,124 m²,marrakech
4 490 000 DH,Villa de haut standing à vendre à Route de l'Ourika. 5 pièce...,Villa de haut standing à vendre à Route de l'Ourika. 5 pièce...,338 m²,marrakech
3 500 000 DH,Excellente villa en vente neuve finie de 4 chambres dans une...,Excellente villa en vente neuve finie de 4 chambres dans une...,260 m²,marrakech
3 500 000 DH,Vente villa de luxe à Hay Targa. 6 pièces. Porte blindée...,Vente villa de luxe à Hay Targa. 6 pièces. Porte blindée...,289 m²,marrakech
7 500 000 DH,Villa a vendre sans vis a vis agdal,Villa a vendre sans vis a vis agdal,371 m²,marrakech
460 000 DH,Appartement de 72m² en vente Dyour Al Masjid,Appartement de 72m² en vente Dyour Al Masjid,Appartement de 72m² en vente Dyour Al Masjid,marrakech
430 000 DH,Appartement de 67m² en vente Dyour Al Masjid,Appartement de 67m² en vente Dyour Al Masjid,Appartement de 67m² en vente Dyour Al Masjid,marrakech
5 000 000 DH,Villa de haut standing à vendre à Agdal. 5 chambres agréable...,Villa de haut standing à vendre à Agdal. 5 chambres agréable...,500 m²,marrakech
480 000 DH,Appartement confortable – M’Hamid 9,Appartement confortable – M’Hamid 9,58 m²,marrakech
8 490 000 DH,Villa de haut standing à vendre à Route Amizmiz. 4 belles ch...,Villa de haut standing à vendre à Route Amizmiz. 4 belles ch...,338 m²,marrakech
4 200 000 DH,Spacieuse villa 4 chambres sur résidence piscine,Spacieuse villa 4 chambres sur résidence piscine,206 m²,marrakech
1 850 000 DH,Superbe appartement à vendre à Guéliz. Surface totale 112 m...,Superbe appartement à vendre à Guéliz. Surface totale 112 m...,112 m²,marrakech
1 700 000 DH,Appartement en vente à Guéliz. 1 belle chambre,Appartement en vente à Guéliz. 1 belle chambre,80 m²,marrakech
3 200 000 DH,"Villa de charme à vendre – Route d’Ourika KM 24, Marrakech","Villa de charme à vendre – Route d’Ourika KM 24, Marrakech",800 m²,marrakech
À partir de 890 000 DH,Ouidane Marrakech – Pavillons R+1,IMMOBILIER NEUF,"par le groupe shems al madina vous propose des pavillons r+1 conçus pour allier espace, confort et modernité. avec des superficies à partir de 84 m² et des prix attractifs dès 950 000 dhs, ce programme",marrakech
27 000 000 DH,El Lmaaden – Propriété d’exception avec vue golf,El Lmaaden – Propriété d’exception avec vue golf,1600 m²,marrakech
3 990 000 DH,"Magnifiqiue villa 4 suites, Rte Ourika KM5, vue Atlas a coup...","Magnifiqiue villa 4 suites, Rte Ourika KM5, vue Atlas a coup...",338294 m²,marrakech
720 000 DH,Bel appartement à vendre à Majorelle. 1 belle chambre,Bel appartement à vendre à Majorelle. 1 belle chambre,40 m²,marrakech
1 975 000 DH,Vend appartement à El Hara. 1 belle chambre,Vend appartement à El Hara. 1 belle chambre,57 m²,marrakech
958 000 DH,Bel appartement à vendre à Guéliz,Bel appartement à vendre à Guéliz,53 m²,marrakech
3 580 000 DH,Villa 4 chambres avec cours Anglaise 4 salons et Piscine Pri...,Villa 4 chambres avec cours Anglaise 4 salons et Piscine Pri...,330 m²,marrakech
4 600 000 DH,Villa Raffinée Meublée à vendre Route de Fès,Villa Raffinée Meublée à vendre Route de Fès,250 m²,marrakech
9 190 000 DH,HAVRE de PAIX dans DOMAINE 10 villas,HAVRE de PAIX dans DOMAINE 10 villas,512 m²,marrakech
2 100 000 DH,Vente d'un beau duplexe à Camp Al Ghoul derrière victor hugo,Vente d'un beau duplexe à Camp Al Ghoul derrière victor hugo,135 m²,marrakech
3 900 000 DH,Villas haut standing à partir de 593 m² à 20 min du centre v...,Villas haut standing à partir de 593 m² à 20 min du centre v...,Villas haut standing à partir de 593 m² à 20 min du centre v...,marrakech
1 300 000 EUR,Vente Palais semi fini avec AVNA Rte Amizmiz,Vente Palais semi fini avec AVNA Rte Amizmiz,740 m²,marrakech
3 100 000 DH,Superbe villa 3 chambres route de Fès VNA Marrakech,Superbe villa 3 chambres route de Fès VNA Marrakech,150 m²,marrakech
12 000 000 DH,Magnifique villa à Targa – 1 280 m² de terrain,Magnifique villa à Targa – 1 280 m² de terrain,Magnifique villa à Targa – 1 280 m² de terrain,marrakech
2 300 000 DH,Opportunité à saisir 2 chambres prestigia,Opportunité à saisir 2 chambres prestigia,80 m²,marrakech
300 000 EUR,Maison traditionnelle de charme,Maison traditionnelle de charme,110 m²,marrakech
5 600 000 DH,"Villa à Vendre de 423.0 m² à Marrakech, Amerchich","Villa à Vendre de 423.0 m² à Marrakech, Amerchich","Villa à Vendre de 423.0 m² à Marrakech, Amerchich",marrakech
1 032 000 DH,Appartement en vente à Route Casablanca. Superficie 48 m²,Appartement en vente à Route Casablanca. Superficie 48 m²,Appartement en vente à Route Casablanca. Superficie 48 m²,marrakech
924 500 DH,Appartement à l'achat à Route Casablanca. 1 chambre,Appartement à l'achat à Route Casablanca. 1 chambre,43 m²,marrakech
11 500 000 DH,Ferme d’exception au sud de Marrakech route dourik,Ferme d’exception au sud de Marrakech route dourik,780 m²,marrakech
