prix,titre,lieu,surface,ville_scrape
Prix à consulter,Splendide villa à vendre à Hay El Menzah. Superficie 1000 m²,Splendide villa à vendre à Hay El Menzah. Superficie 1000 m²,Splendide villa à vendre à Hay El Menzah. Superficie 1000 m²,rabat
2 200 000 DH,Appartement à vendre à Agdal,Appartement à vendre à Agdal,150 m²,rabat
5 900 000 DH,Villas de Luxe El Menzeh,Villas de Luxe El Menzeh,600 m²,rabat
12 000 000 DH,Villa à vendre à Hay Riad,Villa à vendre à Hay Riad,860 m²,rabat
Prix à consulter,Villa 2 niveau avec piscine,Villa 2 niveau avec piscine,1000 m²,rabat
Prix à consulter,Villa de haut standing à vendre à Hay El Menzah. 4 belles ch...,Villa de haut standing à vendre à Hay El Menzah. 4 belles ch...,600 m²,rabat
Prix à consulter,Appartement à vendre,Appartement à vendre,159 m²,rabat
9 100 000 DH,Villa de 730 m² A VENDRE située à Souissi,Villa de 730 m² A VENDRE située à Souissi,Villa de 730 m² A VENDRE située à Souissi,rabat
6 200 000 DH,Villa à vendre sur Hay Riad,Villa à vendre sur Hay Riad,350 m²,rabat
3 350 000 DH,Appartement à vendre Prestigia Rabat,Appartement à vendre Prestigia Rabat,141 m²,rabat
4 100 000 DH,Appartement à vendre,Appartement à vendre,170 m²,rabat
Prix à consulter,"EXCLUSIVITÉ – L’Orangerie, Souissi","EXCLUSIVITÉ – L’Orangerie, Souissi",320 m²,rabat
Prix à consulter,Somptueuse maison à vendre à Hay El Menzah. 4 chambres,Somptueuse maison à vendre à Hay El Menzah. 4 chambres,700 m²,rabat
À partir de 4 462 000 DH,Les Jardins de Val d'or - Villas finies,IMMOBILIER NEUF,,rabat
3 200 000 DH,Appartement à vendre à l Agdal,Appartement à vendre à l Agdal,161 m²,rabat
2 200 000 DH,A vendre Magnifique appartement au centre ville,A vendre Magnifique appartement au centre ville,121 m²,rabat
16 500 000 DH,Jolie Grande Villa à vendre à Soussi Rabat,Jolie Grande Villa à vendre à Soussi Rabat,750 m²,rabat
57 000 000 DH,Maison de luxe à vendre à Al Irfane. 4 grandes pièces. Air...,Maison de luxe à vendre à Al Irfane. 4 grandes pièces. Air...,330 m²,rabat
Prix à consulter,Villa Av d'angle ensoleillé,Villa Av d'angle ensoleillé,298 m²,rabat
Prix à consulter,Villa de 432m² 4façades Hy. Riad,Villa de 432m² 4façades Hy. Riad,Villa de 432m² 4façades Hy. Riad,rabat
2 200 000 DH,Maison à vendre à Hay Al Kora. 3 chambres. Salon traditionne...,Maison à vendre à Hay Al Kora. 3 chambres. Salon traditionne...,200 m²,rabat
11 000 000 DH,Magnifique villa à vendre à Quartier El Menzah 5 belles cha...,Magnifique villa à vendre à Quartier El Menzah 5 belles cha...,870 m²,rabat
9 000 000 DH,"À vendre: Riad à la Médina, Marrakech","À vendre: Riad à la Médina, Marrakech",160 m²,rabat
5 000 000 DH,"Riad à vendre – Médina Kasbah, Marrakech","Riad à vendre – Médina Kasbah, Marrakech",93 m²,rabat
20 000 DH,Superbe appartement location à Riyad. 3 grandes pièces. Bien...,Superbe appartement location à Riyad. 3 grandes pièces. Bien...,150 m²,rabat
75 000 000 DH,Villa a vendre hay ryad,Villa a vendre hay ryad,180 m²,rabat
4 800 000 DH,Appartement à l'achat à Riyad. 6 grandes pièces. Avec asce...,Appartement à l'achat à Riyad. 6 grandes pièces. Avec asce...,240 m²,rabat
2 200 000 DH,A vende Magnifique Riad au cœur de médina Rabat,A vende Magnifique Riad au cœur de médina Rabat,131 m²,rabat
4 300 000 DH,Bel appartement situé dans une résidence fermée avec piscine...,Bel appartement situé dans une résidence fermée avec piscine...,169 m²,rabat
14 800 000 DH,"Villa à rénover en vente à Hay Riad – 741 m² terrain, vocati...","Villa à rénover en vente à Hay Riad – 741 m² terrain, vocati...","Villa à rénover en vente à Hay Riad – 741 m² terrain, vocati...",rabat
4 900 000 DH,Appartement à vendre à Riyad. Superficie 326 m²,Appartement à vendre à Riyad. Superficie 326 m²,Appartement à vendre à Riyad. Superficie 326 m²,rabat
Prix à consulter,Maison de luxe à vendre à Agdal. Surface totale 530 m². Pl...,Maison de luxe à vendre à Agdal. Surface totale 530 m². Pl...,Maison de luxe à vendre à Agdal. Surface totale 530 m². Pl...,rabat
Prix à consulter,Villa de luxe à vendre à Hay El Menzah. 4 chambres,Villa de luxe à vendre à Hay El Menzah. 4 chambres,600 m²,rabat
Prix à consulter,Magnifique villa à vendre à Hay El Menzah. Surface de 700 m²,Magnifique villa à vendre à Hay El Menzah. Surface de 700 m²,Magnifique villa à vendre à Hay El Menzah. Surface de 700 m²,rabat
3 800 000 DH,Maison à la vente à Médina. Superficie 234 m². Salon traditi...,Maison à la vente à Médina. Superficie 234 m². Salon traditi...,Maison à la vente à Médina. Superficie 234 m². Salon traditi...,rabat
Prix à consulter,Maison de luxe à vendre à Hay El Menzah. Surface totale 1200...,Maison de luxe à vendre à Hay El Menzah. Surface totale 1200...,1200 m²,rabat
4 000 000 DH,Appartement à vendre à hay Riad,Appartement à vendre à hay Riad,164 m²,rabat
2 000 000 DH,Appartement à vendre à l'agdal,Appartement à vendre à l'agdal,83 m²,rabat
28 000 000 DH,Villa à vendre Souissi Rabat,Villa à vendre Souissi Rabat,2500 m²,rabat
Prix à consulter,Splendide villa à vendre à Hay El Menzah. 4 chambres agréabl...,Splendide villa à vendre à Hay El Menzah. 4 chambres agréabl...,1000 m²,rabat
5 200 000 DH,Appartement en vente à Souissi,Appartement en vente à Souissi,152 m²,rabat
3 350 000 DH,Appartement à vendre Prestigia Rabat,Appartement à vendre Prestigia Rabat,141 m²,rabat
Prix à consulter,Villa de luxe à vendre à Hay El Menzah. Surface de 1200 m²,Villa de luxe à vendre à Hay El Menzah. Surface de 1200 m²,Villa de luxe à vendre à Hay El Menzah. Surface de 1200 m²,rabat
1 800 000 DH,Appartement à vendre à Agdal,Appartement à vendre à Agdal,118 m²,rabat
Prix à consulter,Somptueuse maison à vendre à Hay El Menzah. 4 chambres,Somptueuse maison à vendre à Hay El Menzah. 4 chambres,600 m²,rabat
Prix à consulter,Somptueuse villa à vendre à Hay El Menzah. 4 belles chambres,Somptueuse villa à vendre à Hay El Menzah. 4 belles chambres,700 m²,rabat
À partir de 4 462 000 DH,Les Jardins de Val d'or - Villas finies,IMMOBILIER NEUF,,rabat
7 300 000 DH,Riad neuf à vendre vue panoramique,Riad neuf à vendre vue panoramique,603 m²,rabat
7 500 000 DH,Villa coloniale à vendre à Les Orangers Rabat – 624 m² de te...,Villa coloniale à vendre à Les Orangers Rabat – 624 m² de te...,Villa coloniale à vendre à Les Orangers Rabat – 624 m² de te...,rabat
25 000 000 DH,Villa à vendre à Souissi. Superficie bâti 1000 m². Belle ter...,Villa à vendre à Souissi. Superficie bâti 1000 m². Belle ter...,Villa à vendre à Souissi. Superficie bâti 1000 m². Belle ter...,rabat
11 000 000 DH,Villa à vendre Hay Riad Rabat,Villa à vendre Hay Riad Rabat,679 m²,rabat
16 500 000 DH,Villa à vendre Bir Qacem Souissi Rabat,Villa à vendre Bir Qacem Souissi Rabat,2004 m²,rabat
28 000 000 DH,Villa à vendre à Souissi,Villa à vendre à Souissi,2000 m²,rabat
2 200 000 DH,Appt residences saada centre ville rabat,Appt residences saada centre ville rabat,138 m²,rabat
1 600 000 DH,Bel appartement à vendre à Guich Oudaya. 3 chambres agréabl...,Bel appartement à vendre à Guich Oudaya. 3 chambres agréabl...,110 m²,rabat
920 000 DH,Appartement 113 m² Hay Nahda vue Tour Mohammed VI,Appartement 113 m² Hay Nahda vue Tour Mohammed VI,Appartement 113 m² Hay Nahda vue Tour Mohammed VI,rabat
10 000 000 DH,Villa de luxe inspiration japonaise à 2 min de Souissi,Villa de luxe inspiration japonaise à 2 min de Souissi,500 m²,rabat
3 500 000 DH,Appartement sur grande avenue Agdal Habita/Bureau,Appartement sur grande avenue Agdal Habita/Bureau,200 m²,rabat
2 500 000 DH,Joli Appartement 136 m² bien situé à l'Océan,Joli Appartement 136 m² bien situé à l'Océan,Joli Appartement 136 m² bien situé à l'Océan,rabat
19 200 000 DH,"Superbe Villa rénovée à neuf, bien située à Souissi","Superbe Villa rénovée à neuf, bien située à Souissi",1900 m²,rabat
3 600 000 DH,Vente Appartement pour bureau ou habitation,Vente Appartement pour bureau ou habitation,233 m²,rabat
20 000 000 DH,Magnifique villa à vendre au quartier des ambassadeurs,Magnifique villa à vendre au quartier des ambassadeurs,2347 m²,rabat
Prix à consulter,Vente villa moderne orangeraie,Vente villa moderne orangeraie,1800 m²,rabat
Prix à consulter,Villa moderne,Villa moderne,2021 m²,rabat
Prix à consulter,Villa moderne à vendre à ou à louer,Villa moderne à vendre à ou à louer,1800 m²,rabat
Prix à consulter,Villa de 3750m². Souissi,Villa de 3750m². Souissi,Villa de 3750m². Souissi,rabat
Prix à consulter,"Villa defaçade, AV, bureau au habitation","Villa defaçade, AV, bureau au habitation",300 m²,rabat
11 000 000 DH,Vente villa à démolir ou à rénover,Vente villa à démolir ou à rénover,2000 m²,rabat
Prix à consulter,Vente villa à l'orangeraie,Vente villa à l'orangeraie,1992 m²,rabat
6 500 000 DH,Vente Villa dans un quartier calme,Vente Villa dans un quartier calme,333 m²,rabat
6 700 000 DH,Villa à vendre,Villa à vendre,360 m²,rabat
6 700 000 DH,Villa a vendre,Villa a vendre,377 m²,rabat
Prix à consulter,Vente villa de luxe à Hay El Menzah. Superficie 700 m²,Vente villa de luxe à Hay El Menzah. Superficie 700 m²,Vente villa de luxe à Hay El Menzah. Superficie 700 m²,rabat
1 700 000 DH,Hay Nahda Appât à usage cabinet médical au RC,Hay Nahda Appât à usage cabinet médical au RC,97 m²,rabat
3 900 000 DH,Appartement à vendre à Riyad. 3 grandes pièces. Terrasse et...,Appartement à vendre à Riyad. 3 grandes pièces. Terrasse et...,300 m²,rabat
12 000 000 DH,Souissi villa plain pied à vendre,Souissi villa plain pied à vendre,1500 m²,rabat
5 000 000 DH,Haut Agdal villa à retaper plain pied à vendre,Haut Agdal villa à retaper plain pied à vendre,386 m²,rabat
12 000 000 DH,ONEP Villa avec ch. Central et piscine à vendre,ONEP Villa avec ch. Central et piscine à vendre,2276 m²,rabat
9 000 000 DH,Villa à vendre OLM Souissi Rabat,Villa à vendre OLM Souissi Rabat,900 m²,rabat
À partir de 7 900 000 DH,18M Avenue : Villas isolées à vendre à Rabat Menzeh,IMMOBILIER NEUF,,rabat
6 600 000 DH,Villa à vendre Hay Riad Rabat,Villa à vendre Hay Riad Rabat,300 m²,rabat
2 800 000 DH,Riad a vendre a rabat,Riad a vendre a rabat,155 m²,rabat
2 400 000 DH,Appartement F4 à vendre sur agdal,Appartement F4 à vendre sur agdal,120 m²,rabat
1 200 000 DH,A vendre 1 chambre salon AL Kamra 60m²,A vendre 1 chambre salon AL Kamra 60m²,A vendre 1 chambre salon AL Kamra 60m²,rabat
Prix à consulter,Villa commerciale choka bolvard,Villa commerciale choka bolvard,733 m²,rabat
2 600 000 DH,Appartement 2 chambre 2 salon 2 terrasse,Appartement 2 chambre 2 salon 2 terrasse,137 m²,rabat
3 900 000 DH,Villa R1 346 m idéal projet villa ou bureau,Villa R1 346 m idéal projet villa ou bureau,346 m²,rabat
2 500 000 DH,Bel appartement à vendre à memzah. Surface de 143 m². Concie...,Bel appartement à vendre à memzah. Surface de 143 m². Concie...,Bel appartement à vendre à memzah. Surface de 143 m². Concie...,rabat
Prix à consulter,Vend appartement à Souissi. 3 chambres,Vend appartement à Souissi. 3 chambres,153 m²,rabat
2 500 000 DH,Vend appartement à menzah. 3 chambres. Vue piscine,Vend appartement à menzah. 3 chambres. Vue piscine,108 m²,rabat
50 000 DH,Location villa neuve à l’Orangeraie – Souissi,Location villa neuve à l’Orangeraie – Souissi,500 m²,rabat
250 000 EUR,Riad de charme a rabat medina,Riad de charme a rabat medina,51 m²,rabat
15 000 000 DH,Villa a vendre au rt el menzeh souissi,Villa a vendre au rt el menzeh souissi,900 m²,rabat
12 500 000 DH,Villa de 1035m² A VENDRE à Souissi RABAT,Villa de 1035m² A VENDRE à Souissi RABAT,Villa de 1035m² A VENDRE à Souissi RABAT,rabat
Prix à consulter,Villa àvendre 330m² hay riad,Villa àvendre 330m² hay riad,Villa àvendre 330m² hay riad,rabat
Prix à consulter,Villa gros œuvre à vendre 440m²,Villa gros œuvre à vendre 440m²,Villa gros œuvre à vendre 440m²,rabat
Prix à consulter,Villa à vendre de 330 m,Villa à vendre de 330 m,330 m²,rabat
1 600 000 DH,Riad non titré à vendre au centre ville,Riad non titré à vendre au centre ville,220 m²,rabat
12 500 000 DH,Villa à vendre Onep Souissi Rabat,Villa à vendre Onep Souissi Rabat,2000 m²,rabat
2 100 000 DH,Appartement à vendre sur Riad Ouled Mtaa Temara,Appartement à vendre sur Riad Ouled Mtaa Temara,104 m²,rabat
5 500 000 DH,Villa à retaper à vendre à Mabella,Villa à retaper à vendre à Mabella,365 m²,rabat
3 200 000 DH,Appartement à vendre à l’Agdal,Appartement à vendre à l’Agdal,156 m²,rabat
3 800 000 DH,Appartement à vendre au haut Agdal,Appartement à vendre au haut Agdal,243 m²,rabat
7 750 000 DH,Appartement lumineux à vendre au haut Agdal,Appartement lumineux à vendre au haut Agdal,352 m²,rabat
9 500 000 DH,Villa à vendre à Hay Riad,Villa à vendre à Hay Riad,600 m²,rabat
5 500 000 DH,Appartement sans vis à vis à vendre au haut Agdal,Appartement sans vis à vis à vendre au haut Agdal,256 m²,rabat
7 000 000 DH,Villa à vendre à Hay Riad,Villa à vendre à Hay Riad,350 m²,rabat
4 000 000 DH,Appartement à vendre à Hay Riad,Appartement à vendre à Hay Riad,164 m²,rabat
4 000 000 DH,Appartement à vendre à l’Agdal,Appartement à vendre à l’Agdal,180 m²,rabat
5 900 000 DH,Villa à vendre aux Orangers,Villa à vendre aux Orangers,600 m²,rabat
9 900 000 DH,Villa à vendre à Hay Riad,Villa à vendre à Hay Riad,300 m²,rabat
3 600 000 DH,Appartement à vendre à l’Agdal,Appartement à vendre à l’Agdal,175 m²,rabat
À partir de 4 462 000 DH,Les Jardins de Val d'or - Villas finies,IMMOBILIER NEUF,,rabat
2 400 000 DH,Appartements neufs à vendre à Mabella,Appartements neufs à vendre à Mabella,111 m²,rabat
2 250 000 DH,Appartement à vendre au bas d'Agdal,Appartement à vendre au bas d'Agdal,108 m²,rabat
6 400 000 DH,Villa à vendre à Hay Riad,Villa à vendre à Hay Riad,240 m²,rabat
7 232 000 DH,Appartement à vendre au haut Agdal,Appartement à vendre au haut Agdal,226 m²,rabat
5 200 000 DH,Appartement à vendre à Jnane Souissi,Appartement à vendre à Jnane Souissi,147 m²,rabat
5 900 000 DH,Villas haut standing à vendre à El menzeh route de Zaer,Villas haut standing à vendre à El menzeh route de Zaer,410 m²,rabat
6 600 000 DH,Villa familiale à Hay Riad proche Nakhil,Villa familiale à Hay Riad proche Nakhil,376 m²,rabat
6 100 000 DH,Une magnifique villa bien placée et orientée,Une magnifique villa bien placée et orientée,250 m²,rabat
8 000 000 DH,Vente villa de 500 m2,Vente villa de 500 m2,500 m²,rabat
13 700 000 DH,"À vendre belle villa Souissi, Rabat","À vendre belle villa Souissi, Rabat",1900 m²,rabat
9 700 000 DH,Villa à vendre,Villa à vendre,1100 m²,rabat
15 000 000 DH,Villa à vendre à l’Orangeraie Souissi,Villa à vendre à l’Orangeraie Souissi,600 m²,rabat
120 000 000 DH,Vente Palais Rabat Souissi,Vente Palais Rabat Souissi,4800 m²,rabat
5 000 000 DH,Vente Villa Rabat Mabella,Vente Villa Rabat Mabella,360 m²,rabat
7 000 000 DH,Vente Riad Rabat La Médina,Vente Riad Rabat La Médina,600 m²,rabat
2 100 000 DH,Vente Appartement Rabat Bas Agdal,Vente Appartement Rabat Bas Agdal,115 m²,rabat
5 500 000 DH,Vente Appartement Rabat Haut Agdal,Vente Appartement Rabat Haut Agdal,235 m²,rabat
13 000 000 DH,Vente Villa Rabat Souissi,Vente Villa Rabat Souissi,650 m²,rabat
1 980 000 DH,Appartement Exclusive à vendre 136 m²,Appartement Exclusive à vendre 136 m²,Appartement Exclusive à vendre 136 m²,rabat
13 730 000 DH,Vente Villa d’Exception Moderne à souissi Rabat,Vente Villa d’Exception Moderne à souissi Rabat,1000 m²,rabat
3 500 000 DH,Vente Appartement Rabat Bas Agdal,Vente Appartement Rabat Bas Agdal,300 m²,rabat
7 500 000 DH,Vente Villa Rabat Hay Riyad,Vente Villa Rabat Hay Riyad,400 m²,rabat
3 900 000 DH,"Vente Villa à Hay Nahda, Rabat","Vente Villa à Hay Nahda, Rabat",300 m²,rabat
5 800 000 DH,Vente Appartement Rabat Hay Riad,Vente Appartement Rabat Hay Riad,210 m²,rabat
7 000 000 DH,Vente Villa Rabat Hay Riad,Vente Villa Rabat Hay Riad,250 m²,rabat
7 500 000 DH,Vente Villa Rabat Hay Riad,Vente Villa Rabat Hay Riad,360 m²,rabat
7 500 000 DH,Vente Villa Rabat Hay Riad,Vente Villa Rabat Hay Riad,411 m²,rabat
15 000 000 DH,Vente Villa Rabat Souissi,Vente Villa Rabat Souissi,1551 m²,rabat
3 700 000 DH,Vente Appartement Rabat Hay Riad,Vente Appartement Rabat Hay Riad,218 m²,rabat
3 185 000 DH,Vente Appartement Rabat Agdal,Vente Appartement Rabat Agdal,182 m²,rabat
2 970 000 DH,Joli Appartement à Rafraîchir à Vendre Bas Agdal,Joli Appartement à Rafraîchir à Vendre Bas Agdal,165 m²,rabat
38 000 000 DH,Villa de Luxe à Vendre à Souissi Rabat,Villa de Luxe à Vendre à Souissi Rabat,1200 m²,rabat
À partir de 4 462 000 DH,Les Jardins de Val d'or - Villas finies,IMMOBILIER NEUF,,rabat
6 500 000 DH,"Villa à vendre mabella aviation, rabat","Villa à vendre mabella aviation, rabat",410 m²,rabat
3 800 000 DH,"Exclusivité – vente appartement hay riad, rabat","Exclusivité – vente appartement hay riad, rabat",179 m²,rabat
24 500 000 DH,"Vente villa de luxe soussi, rabat","Vente villa de luxe soussi, rabat",1000 m²,rabat
7 300 000 DH,Vente Villa en Exclusivité à Rabat Hay Riad,Vente Villa en Exclusivité à Rabat Hay Riad,520 m²,rabat
6 700 000 DH,Vente Villa en Exclusivité à Rabat Hay Riad,Vente Villa en Exclusivité à Rabat Hay Riad,600 m²,rabat
4 000 000 DH,Vente appartement à rabat hay riad,Vente appartement à rabat hay riad,164 m²,rabat
4 972 000 DH,Vente appartement en exclusivité à rabat hay riad,Vente appartement en exclusivité à rabat hay riad,226 m²,rabat
25 000 000 DH,Luxueuse villa à vendre/Quartier Souissi /Rabat,Luxueuse villa à vendre/Quartier Souissi /Rabat,2925 m²,rabat
Prix à consulter,Villa de 4 000 m² à vendre sur Souissi à Rabat,Villa de 4 000 m² à vendre sur Souissi à Rabat,Villa de 4 000 m² à vendre sur Souissi à Rabat,rabat
Prix à consulter,Villa de 2 000 m² à vendre sur Souissi à Rabat,Villa de 2 000 m² à vendre sur Souissi à Rabat,Villa de 2 000 m² à vendre sur Souissi à Rabat,rabat
2 950 000 DH,Vend appartement meublé haut standing à Agdal. 2 chambres ag...,Vend appartement meublé haut standing à Agdal. 2 chambres ag...,115 m²,rabat
1 200 000 DH,Appartement d’une chambre salon à vendre à rabat agdal,Appartement d’une chambre salon à vendre à rabat agdal,60 m²,rabat
2 000 000 DH,À vendre – Appartement 105m² aménagé bureau Agdal,À vendre – Appartement 105m² aménagé bureau Agdal,À vendre – Appartement 105m² aménagé bureau Agdal,rabat
33 000 000 DH,Magnifique villa en vente à Souissi,Magnifique villa en vente à Souissi,2600 m²,rabat
7 500 000 DH,Villa a vendre à agdal,Villa a vendre à agdal,200 m²,rabat
13 000 000 DH,A vendre à Rabat villa refaite à neuf au quartier,A vendre à Rabat villa refaite à neuf au quartier,550 m²,rabat
Prix à consulter,Maison de luxe à vendre à Souissi. Superficie 400 m². Antenn...,Maison de luxe à vendre à Souissi. Superficie 400 m². Antenn...,Maison de luxe à vendre à Souissi. Superficie 400 m². Antenn...,rabat
Prix à consulter,Coquette villa en vente Hay Riad Rabat,Coquette villa en vente Hay Riad Rabat,350 m²,rabat
1 300 000 DH,Apparemment à vendre,Apparemment à vendre,84 m²,rabat
9 600 000 DH,Villa 950m Souissi Pinède,Villa 950m Souissi Pinède,950 m²,rabat
Prix à consulter,Belle villa moderne 1200m Souisi,Belle villa moderne 1200m Souisi,1200 m²,rabat
11 000 000 DH,Villa 1700m Souisi proche,Villa 1700m Souisi proche,1700 m²,rabat
5 200 000 DH,Vente d'un bel appartement à Riyad. 3 chambres agréables. Av...,Vente d'un bel appartement à Riyad. 3 chambres agréables. Av...,215 m²,rabat
1 100 000 DH,Studio à vendre à Agdal. 1 chambre,Studio à vendre à Agdal. 1 chambre,37 m²,rabat
45 000 000 DH,Villa a vendre,Villa a vendre,2100 m²,rabat
Prix à consulter,Villa plain pied à vendre,Villa plain pied à vendre,1100 m²,rabat
Prix à consulter,Vente appartement moderne,Vente appartement moderne,183 m²,rabat
Prix à consulter,Somptueuse villa à vendre à Souissi. 6 chambres. Meublé,Somptueuse villa à vendre à Souissi. 6 chambres. Meublé,2500 m²,rabat
Prix à consulter,Splendide villa à vendre à Souissi. 4 grandes pièces. Porte...,Splendide villa à vendre à Souissi. 4 grandes pièces. Porte...,2000 m²,rabat
4 200 000 DH,Appartement coquet à vendre Hay Riyad Rabat,Appartement coquet à vendre Hay Riyad Rabat,172 m²,rabat
20 000 000 DH,Villa Haut Standing à vendre à ONEP Souissi Rabat,Villa Haut Standing à vendre à ONEP Souissi Rabat,1900 m²,rabat
7 500 000 DH,Vente d’un superbe duplex sur prestigia hay riad,Vente d’un superbe duplex sur prestigia hay riad,400 m²,rabat
À partir de 7 900 000 DH,18M Avenue : Villas isolées à vendre à Rabat Menzeh,IMMOBILIER NEUF,,rabat
4 400 000 DH,Appartement à vendre – Agdal,Appartement à vendre – Agdal,266 m²,rabat
4 700 000 DH,Vente appartement Rabat Hay Riad Prestigia,Vente appartement Rabat Hay Riad Prestigia,165 m²,rabat
5 600 000 DH,Villa à vendre à Hay Nahda,Villa à vendre à Hay Nahda,433 m²,rabat
22 000 000 DH,Villa à louer sur Souissi,Villa à louer sur Souissi,2000 m²,rabat
Prix à consulter,Villa à vendre à Riyad. Surface de 370 m²,Villa à vendre à Riyad. Surface de 370 m²,Villa à vendre à Riyad. Surface de 370 m²,rabat
Prix à consulter,Villa en vente d'un superfiçie de 240m²,Villa en vente d'un superfiçie de 240m²,Villa en vente d'un superfiçie de 240m²,rabat
5 700 000 DH,Villa a vendre a hay nahda rabat,Villa a vendre a hay nahda rabat,433 m²,rabat
10 138 000 DH,Appartement Triplex d’Exception à Vendre a hay Riad,Appartement Triplex d’Exception à Vendre a hay Riad,417 m²,rabat
10 000 000 DH,Exceptionnel Penthouse haut standing Hay Riad,Exceptionnel Penthouse haut standing Hay Riad,700 m²,rabat
2 800 000 DH,Bel appartement dans une résidence fermée à la Marina,Bel appartement dans une résidence fermée à la Marina,100 m²,rabat
9 200 000 DH,Magnifique villa avec piscine en vente à Hay Riad,Magnifique villa avec piscine en vente à Hay Riad,530 m²,rabat
9 630 000 DH,Magnifique villa avec un grand jardin en vente à Hay Riad,Magnifique villa avec un grand jardin en vente à Hay Riad,642 m²,rabat
6 600 000 DH,Villa à vendre Hay Riad Rabat,Villa à vendre Hay Riad Rabat,300 m²,rabat
13 500 000 DH,Maison à vendre dans un emplacement très rare,Maison à vendre dans un emplacement très rare,450 m²,rabat
Prix à consulter,Superbe appartement à vendre à Souissi. 2 belles chambres. P...,Superbe appartement à vendre à Souissi. 2 belles chambres. P...,175 m²,rabat
Prix à consulter,Superbe appartement à vendre à Agdal. 3 belles chambres. Asc...,Superbe appartement à vendre à Agdal. 3 belles chambres. Asc...,175 m²,rabat
2 400 000 DH,Maison à vendre bas agdal,Maison à vendre bas agdal,130 m²,rabat
72 000 000 DH,Ryad a vendre,Ryad a vendre,200 m²,rabat
Prix à consulter,A vendre villa Quartier Ambassadeur,A vendre villa Quartier Ambassadeur,700 m²,rabat
9 300 000 DH,Unité Premium Ensoleillée 313m2 Cara 1 Orangeraie,Unité Premium Ensoleillée 313m2 Cara 1 Orangeraie,313 m²,rabat
2 700 000 DH,Vente Appartement RDC avec jardin Rabat Mabella,Vente Appartement RDC avec jardin Rabat Mabella,216 m²,rabat
2 000 000 DH,Vente Appartement Bas Agdal Rabat,Vente Appartement Bas Agdal Rabat,132 m²,rabat
2 497 000 DH,Appartement à vendre bas agdal rabat,Appartement à vendre bas agdal rabat,140 m²,rabat
5 600 000 DH,Vente appartement d'exception hay riad rabat,Vente appartement d'exception hay riad rabat,245 m²,rabat
5 400 000 DH,"Vente appartement exclusif haut agdal, rabat","Vente appartement exclusif haut agdal, rabat",258 m²,rabat
2 283 000 DH,Vente appartement exclusif rdc haut agdal,Vente appartement exclusif rdc haut agdal,160 m²,rabat
17 950 000 DH,Vente villa en exclusivité à rabat souissi,Vente villa en exclusivité à rabat souissi,500 m²,rabat
13 500 000 DH,Vente villa à rabat souissi,Vente villa à rabat souissi,550 m²,rabat
3 400 000 DH,Maison à vendre à Rabat,Maison à vendre à Rabat,230 m²,rabat
12 000 000 DH,Maison à vendre à Souissi. Surface 2050 m²,Maison à vendre à Souissi. Surface 2050 m²,Maison à vendre à Souissi. Surface 2050 m²,rabat
5 200 000 DH,Maison R1 à vendre à 100m du Carrousel,Maison R1 à vendre à 100m du Carrousel,160 m²,rabat
1 800 000 DH,Bel appartement à vendre à Agdal,Bel appartement à vendre à Agdal,60 m²,rabat
À partir de 4 462 000 DH,Les Jardins de Val d'or - Villas finies,IMMOBILIER NEUF,,rabat
9 300 000 DH,"À VENDRE – Villa familiale aux Orangers, Rabat","À VENDRE – Villa familiale aux Orangers, Rabat",625 m²,rabat
13 000 000 DH,Villa à vendre Souissi Rabat,Villa à vendre Souissi Rabat,1034 m²,rabat
2 700 000 DH,Appartement en vente à Agdal. Surface totale 137 m². Porte b...,Appartement en vente à Agdal. Surface totale 137 m². Porte b...,Appartement en vente à Agdal. Surface totale 137 m². Porte b...,rabat
Prix à consulter,Appartement. 17. Zair à l'achat à Souissi. 2 chambres. Conci...,Appartement. 17. Zair à l'achat à Souissi. 2 chambres. Conci...,190 m²,rabat
Prix à consulter,Magnifique villa à vendre à Souissi. 5 belles chambres. Salo...,Magnifique villa à vendre à Souissi. 5 belles chambres. Salo...,2000 m²,rabat
3 900 000 DH,Location d'un appartement à Agdal. Surface totale 190 m². Do...,Location d'un appartement à Agdal. Surface totale 190 m². Do...,Location d'un appartement à Agdal. Surface totale 190 m². Do...,rabat
9 500 000 DH,Villa de luxe à vendre à Riyad. Secteur 14,Villa de luxe à vendre à Riyad. Secteur 14,496 m²,rabat
